,course_title
1024,Trading Algorítmico en Forex: Crea tu primer Robot de Forex!
1025,MQL4 Bootcamp Tutorial- Trading Robot Coding in Metatrader4
1026,Introducción a la contabilidad
1027,Einnahmen aus Udemy-Kursen als Dozent korrekt versteuern
1028,Contabilidad Gubernamental en México
1029,株式投資に必要なスキルの学習手順を学ぶ
1030,Formação de preços em serviços
1031,"Geld verdienen mit dem Ticken der Uhr, wie Warren Buffett!"
1032,Торговля дельта-нейтральными стренглами
1033,Guía práctica para comprar acciones en la Bolsa de USA
1034,Contabilidad Financiera: Conoce el Lenguaje de los Negocios.
1035,Curso de Day Trader para Iniciantes
1036,Curso de Iniciación al Trading
1037,Complete GST Course For Small and Medium Enterprises
1038,3 documentos clave para administrar tu empresa con éxito
1039,Forex/Opciones Binarias para Principiantes
1040,15 Mandamientos para ganar dinero en Bolsa
1041,Le bitcoin et la blockchain
1042,Contabilità Generale
1043,Торговля опционами: Как заработать на волатильности
1044,Estrategias de Inversión aplicadas al mundo del trading
1045,バイナリーオプション取引
1046,Caza los Enormes Movimientos del Mercado
1047,Le basi del trading online
1048,自分に合った投資信託を見つけよう！
1049,Monatlich Geld anlegen für später!
1050,Invierte en la Bolsa Mexicana y de USA
1051,Gestão Financeira Para Pequenas e Médias Empresas
1052,Curso Completo de Bitcoin - Ganhe 0.00005 Bitcoin
1053,Tudo sobre Investimentos em Renda Fixa
1054,Aprende a invertir sin capital
1055,Apprendre à trader sur le marché du Forex - guide complet
1056,Introducción a las Finanzas
1057,Finanzielle Unabhängigkeit-1: Erste Schritte zur Million
1058,Forex para Principiantes-Ejemplos en VIVO de Trading Real
1059,Finanzielle Unabhängigkeit-3 Millionär werden mit Immobilien
1060,Introduction to Health Financing
1061,Accounting Cycle: Learn the concepts in 60 minutes
1062,Optimize! Make Best Decisions with Microsoft Excel
1063,Understanding The Stock Market: For Beginners
1064,CFA® Level 1 2014 – FI
1065,9. Sinking Funds
1066,Managerial Accounting - The Ultimate Beginner Course!
1067,Forex Trading for Beginners Vol 1:A Forex Course Made Simple
1068,Accounting - Basic Costing 
1069,"Double Your Salary With Free, Local, Job Training Courses"
1070,Financial Modeling - Facebook Case Study
1071,Understanding Financial Derivatives
1072,Forex Basics: Learn how to read and analyze Forex charts
1073,Forex - Help I cant Trade
1074,Start-up financial modeling for non-finance professionals
1075,The Fast Route to a Faster Financial Close
1076,Easy Finance For Startups
1077,"Excel 4 Accounting & Bookkeeping - Master Date,Time & Text"
1078,"Depreciation, Amortization and Depletion"
1079,Breakeven Analysis and Pricing
1080,Tally ERP Complete Training in Urdu / Hindi
1081,Accounting Simplified
1082,Series 7: Intermediate Options
1083,Accounting and Business Basics
1084,Corso introduttivo al trading profittevole
1085,Aprende a Ganar Dinero en la Bolsa
1086,Inversión: Fundamentos del Trading para Principiantes
1087,Gana en la Bolsa con Análisis Técnico
1088,Precificação - Calculando valor de venda baseado nos custos
1089,Cómo ganar dinero invirtiendo en bolsa
1090,Investiere in Tax Liens-Hohe Zinsen gesetzl. festgeschrieben
1091,Investimento em Ações
1092,Excelを使ってビジネスシミュレーション：基礎編
1093,Estrategias de trading en bolsa
1094,Grundlagen der finanziellen Unabhängigkeit
1095,"Wie Du, Dir auch mit kleinen Beträgen ein Vermögen aufbaust"
1096,Corporate Ethics
1097,Core Financial Statement Concepts
1098,Understand Core Finance Principles in 60 Minutes
1099,Learn Wave accounting to maintain books properly
1100,Making Tax Digital - UK HMRC Legislation Explained
1101,Surviving Introduction to Finance
1102,Cost of Capital and Weighted Average Cost of Capital
1103,Studying the CFA Program exams (Mandarin language version)
1104,Condor Broken Wing Butterfly Options Trading Course System
1105,≪虎の巻≫証券取引の「税金のお悩み」解消
1106,【１日でマスター！】今日からはじめる資産形成
1107,TRADING FOR A LIVING: Trading Full-Time Transition Guide
1108,Learn How To use Channels to find amazing Forex Entries
1109,"Financial Analysis, from Scratch to Professional!"
1110,Cost Accounting Labour Costing (Professional Course Level)
1111,Learn How To Successfully Trade Forex: In 5 Simple Steps
1112,The Intelligent Investor
1113,Succeed in Futures Even if You Don't Know Where to Start
1114,Binary Options Beginners Guide : Nadex
1115,Trading: From Wall Street to Your Street
1116,Build your own Naked Trading Forex Robot
1117,Tax Preparation: Learn Fast! Prepare Taxes with Confidence!
1118,Tax Strategies of the Wealthy
1119,The Ultimate Fibonacci Trading Plan for Forex and Stocks
1120,Finance and Accounting for Startups
1121,Forex - Calculate Lot Size Like Pro
1122,The Complete Forex Trader
1123,Tape Reading: Learn how to read the tape for day trading
1124,4 Easy Daily Forex Trades: A Recipe for Trading Success
1125,Trading Robot Forex Programs in Your Sleep in Live Examples!
1126,Free Options 101 - Basic of Call and Put Options in 1 Hours
1127,An Intro into Trading the Financial Markets
1128,Developing A Trading Strategy: Your Guide to Trading Success
1129,How to Trade Commodity and Financial Futures for a Living!
1130,How to Trade Forex like a Hedge Fund: Long FX Strategies
1131,Complete Short Financial Ratio Course for Financial Analysis
1132,How to Build Profitable FOREX Automated Trading Strategies!
1133,Stock Trading Strategies: Profitable Trading in 7 Days.
1134,Management Accounting A Complete Study
1135,Become a Career Day Trader: Asian-Pacific Futures Markets
1136,Equity Products
1137,Financial Accounting Part I - Passing the Class
1138,Accounting 102: Guide to Business Accounting
1139,Monetizing Your Website: How to Add Cost-Per-Action (CPA) 
1140,Advanced Finance and Accounting for Startups
1141,Basics of Tax in India  (College Level)
1142,Trade for a Living
1143,Learn Stock Options: Options Made Simple 101
1144,Banking Credit Analysis Process (for Bankers)
1145,Professional Forex strategy
1146,A Beginners Guide to Technical Analysis of Stock Charts
1147,Get out of Debt - The Power of Using Compounding Interest
1148,Day Trading - Learn to Day Trade / Swing Trade In One Hour.
1149,Basel Norms (Basel 1/ Basel 2/ Basel 3) Simplified
1150,Learn to Trade Forex Naked Price Action Wammie Trade
1151,Fixed Income Securities
1152,Financial Accounting Made Easy for All
1153,Ultimate Guide To Trading Engulfing Candlestick Strategy
1154,Learn Business Finance: Win more work as a Business Coach 
1155,Accounting for Depreciation (Collage Level)
1156,Revealed: Profitable Principles of Successful Traders 
1157,Easy Market Profits: 3 Step Stock Investing Strategy
1158,Hedge Fund Trading Systems For Stocks - Part One
1159,Bonds For Beginners - A Guide To The Bond Markets
1160,Professional Risk Manager (PRM) Certification: Level 4
1161,Crowdfunding for Filmmakers
1162,How to Make IT Work Successfully in Capital Markets
1163,Introduction to Day Trading
1164,Life Coach Business Basics: Finance and Operations
1165,Learn How to Profit In Forex With Market Rhythms
1166,Optimizing investment to maximise your return
1167,Investimento em Ações para Leigos
1168,Introducción a la Contabilidad
1169,Forex Trading: Strategia Correlazione EUR/GBP vs GBP/USD
1170,Finanzielle Unabhängigkeit-2 Millionär werden mit Investment
1171,カードゲームでカンタンに理解する！経済とお金のキホン
1172,Contabilidad rápida y eficaz
1173,Introducción al trading de opciones
1174,Aprenda a Investir seu Dinheiro
1175,Trader sur le Forex avec Ichimoku
1176,العلوم والمبادئ الأساسية للمهنة الإكتوارية
1177,トレーディングビュー徹底攻略2017年版
1178,Kostenrechnung lernen leicht gemacht
1179,MetaTrader4 Platform Training
1180,Professional Bookkeeping & Accounting 1: Sales & Purchases
1181,Step by step guide to understand how business perform
1182,How to Grow your Small Business and not run out of Cash
1183,Finance for Non Finance Executives
1184,"An Introduction: MT4 Email, Sound, Notification Forex Alerts"
1185,Innovators and innovation: Travel through time!
1186,Learn How to Trade The Stock Market
1187,How To Earn Some Bitcoin Every Time You Use A Search Engine
1188,Super Fast Accounting - the fastest way to do your books
1189,Financial Modeling and Valuation: Complete Beginner to Pro
1190,Learn to trade Chart Patterns
1191,Anatomy and Figure Drawing for Beginners
1192,Illustrator CC MasterClass
1193,Typographic Logo Design in Illustrator - Beginners & Beyond
1194,Adobe Illustrator T-Shirt Design for Merch by Amazon
1195,Logo Design in Adobe Illustrator - for Beginners & Beyond
1196,Learn Adobe Illustrator: Semi-Automatic Mandalas Drawing
1197,Create Professional Looking Infographics With No Experience
1198,Discover How to Draw and paint Comics
1199,Typographic Logos: Typography and Lettering for Logo Design
1200,Photoshop in Ease: Create World Amazing  Graphic Designs
1201,Canva Graphics Design Essential Training For Everyone
1202,Triangulated Bird: Origami Styled Bird in Adobe Illustrator
1203,Illustrator Quick Tip：10分でKawaiiカメレオンを描こう
1204,Deinen Roman setzen mit PagePlus in 10 einfachen Schritten
1205,画像加工の初心者でも「１日」で初歩を覚えられる無料講座
1206,Graphic Design Bootcamp
1207,The Ultimate Drawing Course - Beginner to Advanced
1208,Ultimate Photoshop Training: From Beginner to Pro
1209,Photoshop for Entrepreneurs - Design 11 Practical Projects
1210,Anatomy for Figure Drawing: Mastering the Human Figure
1211,Sketch 3 from A to Z: Become an App Designer
1212,How to Design a Logo - a Beginners Course
1213,Logo Design Masterclass: Learn Logo Design + Illustrator
1214,How to Draw and Sketch for Beginners
1215,Graphic Design Masterclass: Learn Graphic Design in Projects
1216,Canva Graphics Design for Entrepreneurs - Design 11 Projects
1217,Vector Logo Design in Affinity Designer
1218,How To Create A Low Poly Portrait With The Pen Tool
1219,Photo Editing in Photoshop - Beginner to Advanced in 1 Hour
1220,How to Create Kindle & Ebook Covers with Canva
1221,How To Make Professional eBook Covers For FREE
1222,Design Business Card in Photoshop: Earn Money by Doing It
1223,Learn to create beautiful web interfaces and logos
1224,Illustrated Logo Design
1225,Color Basics for Print Designers
1226,Digital Photo Manipulation Art And Cover Design In PhotoShop
1227,Drawing Perspective For Beginners
1228,Adobe InDesign CC Advanced
1229,Intro to Photoshop for Merch by Amazon
1230,MicroStation - Células
1231,Photoshop - Creación de Efectos 2
1232,Como Criar Logos de Sucesso - Start Designer
1233,Super Textos con Photoshop
1234,Photoshop - Aprende a Transformar Imágenes
1235,Iníciate en Microstation
1236,Adobe Photoshop pentru Social Media
1237,Photoshop - Creación de Efectos
1238,Cómo crear maquetas con Adobe XD
1239,Aprenda Modelagem 3D com o 123D Design
1240,Ferramentas Visuais
1241,Adobe Indesign CC Başlangıç
1242,How to Doodle: Basics and Lettering
1243,Mastering Photoshop CC 2017 - The Art of Design & Technology
1244,Design a logo for FREE in Inkscape
1245,Foundation Skills on Adobe Illustrator: Learn Fast!
1246,How To Create Amazing Cinemagraphs with Microsoft PowerPoint
1247,Canva : Graphic Design Theory Volume1
1248,Master App Icon Design for iPhone (IOS) & Android Devices
1249,Photoshop: How to create stunning collages
1250,Mastering advance Photoshop
1251,Logo Designing for Your Business in an Hour
1252,DIY Design Professional Web Banners in Photoshop 4 Beginners
1253,Photoshop CC for Beginners - A Comprehensive Crash Course
1254,Teoria Basica del Arte. Como Pintar Ilustraciones Digitales
1255,Illustrator CC para novatos: ¡desde cero hasta experto! 
1256,Photoshop para novatos:  ¡desde cero hasta experto!
1257,Diventa un professionista del Graphic Design
1258,Formação em Design Gráfico com Corel Draw Versões X8 / 2017.
1259,ABC do Photoshop CC
1260,Photoshop para iniciante - o básico
1261,Curso Online de Adobe Illustrator CC e CS6
1262,Photoshop & Illustrator CC Essentials in Arabic
1263,Photoshop from Zero to Hero ( Arabic )
1264,Photoshop Essentials - Uma Introdução Detalhada
1265,Photoshop CC 2015 Top New Features
1266,Expert Guide : Mastering Types feature in illustrator !
1267,Cartoon Game Logo Design using Photoshop
1268,Most Wanted Flat Design Techniques #2: Hipster Businessman
1269,All-in-One Premium Design Course - Scratch to Pro+ Edition
1270,Typography 101: Picking the Right Fonts for Business Success
1271,Editorial Illustration Tutorial: From Drawing to Photoshop
1272,Kindle eBook Cover Design and Book Illustration Guide
1273,Removing Backgrounds From Images using Adobe Photoshop
1274,Graphic Design Secrets Revealed
1275,Drawing in Perspective
1276,"Digital Art in Adobe Illustrator CC: Angry Bird, Tom & Jerry"
1277,Adobe Illustrator For Beginners: Design A Typographic Logo
1278,Surface Pattern Design : Create Scandinavian Patterns
1279,Draw a realistic Fantail using pencil
1280,How to design a business card on Photoshop (for beginners)
1281,Make Flat Design Space Ships in 30 Minutes in Illustrator!
1282,Figure Drawing From Life Using The Reilly Technique.
1283,Drawing Cartoony Characters
1284,Learn Blender 3D  - The introduction course
1285,Inkscape For Beginners 2016/2017
1286,Make yourself a Santa Claus: Photoshop Manipulation
1287,Become an InDesign Pro in 10 Skills
1288,Digital Illustration: Make A Custom Character Illustration
1289,Learn Basics Of Adobe Illustrator
1290,Discover the 7 Secrets to Figure Drawing: Draw Awesome ...
1291,LOGO DESIGN IN POWERPOINT
1292,Photoshop CC MasterClass
1293,Become A Logo Designer 
1294,Learn Illustrator By Recreating Top 3 Logos - Beginner Guide
1295,Illustrative Surface Patterns Design : From Life To Products
1296,Effective iOS & Android App Icon Design
1297,Creating an animated greeting card via Google Slides
1298,Photoshop: Learn Digital Painting Basics in Photoshop
1299,Learning Photoshop CC 2014 in Egyptian Arabic 
1300,Make tech circles in Photoshop in 30 minutes!
1301,Graphic design - The Quick Guide
1302,Learn Corel x7 Like a Pro
1303,Make tech circles in Adobe Illustrator in 30 minutes
1304,Easy Illustration and 2D Animation
1305,Make Tech circles in Adobe Photoshop and Illustrator
1306,Turn Your Photos Into Professional And Modern Artworks
1307,Calligraphy for Beginners: Creating Strong Lines
1308,Canva: Design Album Cover Artwork in Minutes - No More Fees!
1309,Getting Started With Photoshop CC
1310,Learn Adobe Photoshop in 1 Hour
1311,Learn Comic Book Color Flatting! (Coloring Assistant role)
1312,Illustrator - Creating stylised images from a photo
1313,Gimp In-Depth Essential Training Course: Free Photoshop Alt.
1314,Conviértete en un experto de photoshop cc naked series
1315,CORSO COMPLETO DI E-ON VUE X-STREAM PER TUTTI
1316,商業好設計-Illustrator個性商品設計
1317,Ilustración de la A a la Z
1318,Diseño Gráfico fácil y rápido.
1319,超基礎！超入門！〜作りながら学ぶ。完全無料3DCGソフトBlender〜
1320,调色高级讲解
1321,Curso de Corel Draw: Como Hacer Todo para tu Fiesta Temática
1322,Infodesign
1323,تصميم القوالب الدائرية بالفيغاس | Circular Templates Vegas
1324,Affinity Designer - tworzenie wzorków
1325,Photoshop: Creando efectos de luz
1326,Learning Photoshop CC 2015
1327,Create Awesome Ebook Covers Using Microsoft Word
1328,Photoshop Essentials: Designing FaceBook Graphics
1329,Advance Learning Tools Corel Draw Graphics Design
1330,Creating an animated greeting card via Google Slides
1331,Logo Design for Entrepreneurs 
1332,Sketch 3: Design a mobile application from scratch
1333,Draw a Kitten
1334,Adobe Photoshop Essentials: Master Adobe Photoshop CS6
1335,Learn GIMP
1336,Texturing For Designers - Bring Life to Design With Textures
1337,Learn Advanced Photoshop Selections
1338,InDesign: Diseño de proyectos paso a paso
1339,Domina el Diseño Gráfico para Web con Photoshop CC
1340,Graphicriver Autor – Verkaufe deine Designs online
1341,Adobe Illustrator CC
1342,캔바(Canva)로 SNS 콘텐츠 만들기
1343,"Illustrator para criação de peças gráficas, Design Gráfico"
1344,Photoshop Workflow - Manipulação de imagem para Publicidade
1345,Como Produzir Ebook e Livros com Adobe Indesign CC e CS6
1346,Curso básico de Gimp; software gratis de diseño gráfico
1347,Curso Completo de SolidWorks 2016.
1348,なぞるだけですぐできる! 簡単手描きイラスト講座
1349,Découvrez InDesign en 1 heure
1350,Convert Image to Vector in Adobe illustrator
1351,Design & Create Vector Graphics With Inkscape 2016
1352,GIMP for Beginners. Make Your Own Professional Book Covers
1353,Learn Photoshop Quickly (For Bloggers & Web Images)
1354,Photoshop CC 2017 for Beginners: Master Photoshop Essentials
1355,Voxel 3D Model Creation Course
1356,Logo Design: Mastering the Wordmark
1357,The Complete Canva Course
1358,Learn Photoshop for Design: 100% Practical Projects
1359,Logo Design Theory & Application Bootcamp
1360,LaTeX for Professional Publications
1361,The Design Theory Blitz
1362,Book Design With MS Word And Canva 
1363,Learn to Design a Letterhead - A Beginners Course
1364,Creating Icons with Adobe Illustrator
1365,Create Stunning Infographics to Share your Ideas
1366,How to stylize your photos in Photoshop with color overlays
1367,Business Card and Letterhead Design in Adobe Illustrator
1368,A Complete Guide to Successful Freelance Logo Design Career
1369,The Logo Design Process From Start To Finish
1370,Creative logo design with Inkscape for free
1371,Typography Fundamentals - Feel confident with type!
1372,How To Sell Your Art Online With ETSY
1373,Ultimate Guide on Freelancing Career in Photoshop Design
1374,Photoshop - Como criar Fusão de forma profissional
1375,"Photoshop, Illustrator, InDesign & Graphic Design Principles"
1376,Photoshop - Tratamento de pele profissional
1377,Indesign - Para quem quer trabalhar com Design Gráfico
1378,Primeros Pasos con Photoshop CC
1379,Cómo Diseñar Logos
1380,Photoshop para principiantes: ¡De cero a experto!
1381,Photoshop Avançado - Pós Produção e fusão com 3D
1382,ABC do Adobe Illustrator
1383,خطوتك الأولى لتعلم الفوتوشوبPhotoshop
1384,master course - realistisch zeichnen lernen
1385,Photoshopマスターコース　基礎から上級まで　ステップバイステップでPhotoshopのすべてを学ぼう
1386,Professional Logo Design in Adobe Illustrator
1387,Learn UI/UX and Mobile App Design in Photoshop from Scratch
1388,Mastering Photoshop: From Beginner to Industry Professional
1389,Expert Retina / HiDPI Graphics in Photoshop & Illustrator
1390,Start Making Comics with Manga Studio 5 / Clip Studio Paint
1391,Most Wanted Flat Design Techniques #1: Desert Island
1392,Photoshop Quickstart Guide to Digital Sketching
1393,Gestalt Principles & Pattern Design : Create Festive Pattern
1394,Logo Design - Design a Logo in Photoshop for beginners
1395,Advanced Features in Adobe Illustrator
1396,"YOU can Draw, Shade and Paint a Mixed Media Girl...today!"
1397,Photoshop | GIMP: Quick & Easy Image Hacks for Beginners
1398,Learn Photoshop CC Essentials
1399,Mobile App Design: From Beginner to Intermediate
1400,Text based Logo Design for Business Using Adobe Photoshop
1401,Graphic Design for Entrepreneurs...Who Can't Draw
1402,BUSINESS CARD DESIGN IN POWERPOINT
1403,Adobe - How to create a professional Video Title/ Web Banner
1404,How to Design an Awesome Letterhead in Adobe Illustrator
1405,Graphic Design - An Overview of the Field
1406,✔️ Illustrator CC : Be a Graphic Designer in Illustrator CC
1407,FLAT ICON DESIGN IN POWERPOINT
1408,Logo Design By Example : Design 5 Famous Logos
1409,Bring your sketch to life - learn digital illustration
1410,Learn Cinema 4D: Create an Abstract Background
1411,The Art of Icon Design: Create Custom Flat Icon Designs
1412,Design Tickets and Vouchers in Photoshop and Illustrator
1413,Blender Modelling Series - Volume Two
1414,Master Adobe Photoshop Lightroom CC - From Beginner to Advan
1415,Design bestselling T-shirts from Beginner to Expert.
1416,Digital Painting for Cartoon Characters
1417,Create Animated Gif Advertising Banners in Photoshop CC
1418,The Play-Doh Technique: Fun Hand-made Vectors In Illustrator
1419,Photo Manipulation: Master Photo Editing
1420,How to create flat design icons in 15 minutes in Illustrator
1421,Adobe - Create a professional logo step-by-step (Beauty)
1422,Essential Skills for Designers - Mastering the Pen Tool
1423,Morphing  with After Effect : Everything you need to know
1424,Learn  After Effects and master 3d layers in after effects
1425,Learn Adobe Illustrator CC - All Essentials In 1 Hour!
1426,History of Art and Design from XV to XXI century
1427,App Design + Web Design + Photoshop = Combined Course
1428,Adobe Illustrator CC for beginners
1429,Complete Portrait and Figure Drawing (step-by-step)
1430,Adobe Illustrator: Learn Easy Logo Design.
1431,Create Beautiful Compelling Social Media Banners With Canva
1432,Become a Professional Logo Designer
1433,Learn Photoshop Actions - Save time with repetitive tasks
1434,Essential Skills for Designers - Masking
1435,Mastering Photoshop Elements 13 Made Easy Training Tutorial
1436,"Become a Graphic Designer, and earn a living from it"
1437,Learn 2D Cell Shading in Photoshop
1438,Adobe Illustrator For Everyone: Create Detailed Vector Image
1439,Learn Digital Drawing in Photoshop
1440,Quickly Batch Export & Package Logo Files for Clients
1441,Logo Design for Everybody
1442,Pixelmator - Create Vector Graphics From Scratch
1443,Creating an animated greeting card via Google Slides
1444,Most Wanted Flat Design Techniques #3: Office Space
1445,Flat Design - Create Beautiful Flat Graphics In Photoshop
1446,T-Shirt Design Workshop 01: Foundation
1447,Expert Guide : Mastering Shapes Creation with Illustrator
1448,Logo Portfolio in 1 Hour in Wordpress
1449,Complete Digital Painting Training with Corel Painter
1450,How to Design Simple Promotional Materials in Photoshop
1451,Design and Animate a Gamer UI
1452,Learn Blender 3D - The materials and texture course
1453,FACEBOOK COVERS IN POWERPOINT
1454,"Quote Images for Pinterest, Facebook, & Instagram"
1455,Adobe Illustrator: Create a Quick & Easy Unique Illustration
1456,Learn to Design a Logo in Adobe Illustrator
1457,Photoshop In-Depth: Master all of Photoshop's Tools Easily
1458,Diseño de logo para principiantes
1459,After Effects - Alles rund um das Tracking
1460,Introducción al retrato realista con Photoshop
1461,Uso Básico de Adobe Photoshop
1462,Técnicas Photoshop: Reformar Campo de golf
1463,誰でもわかる Adobe Illustrator CS5
1464,誰でもわかる Adobe Photoshop CS5
1465,MicroStation - Niveles
1466,Crea personajes fantásticos con Photoshop
1467,Letras en Adobe Illustrator
1468,Photoshop: Creando elemental de aire
1469,Nuke X: Aprende composición digital
1470,สร้างงานกราฟฟิคแอพพลิเคชั่นมือถือด้วย Adobe Illustrator
1471,Photoshop: Creando elemental de agua
1472,７日でマスター  ビギナー向け Adobe Illustrator　どきどきセミナー
1473,Si eres nuevo en Photoshop...Este es tu curso Nº1
1474,Intro to Illustrator
1475,画像加工の初心者だとしても、１週間でホームページのトップ画像を製作できるようになる画像製作講座
1476,Photoshop - Automatização com Adobe Script
1477,دورة شامل لبرنامج إلستريتور للمبتدئين - Adobe illustrator CC
1478,Corel Draw X8 Başlangıç Eğitimi (YENİ)
1479,Formation Photoshop
1480,8 Stunden professionelles Cinema 4D Training
1481,Clipping Masks & Shaped images in Adobe Photoshop CC
1482,Expert Guide : Mastering Photoshop Smart Objects in depth !
1483,Portrait Typography in Photoshop - Anyone can do Typography
1484,Mastering Retouching and Restoration (15 projects Included)
1485,Make flat design trees in Adobe Illustrator in 30 minutes!
1486,Photoshop Fantastic! - The Comprehensive Guide to Photoshop
1487,Drawing in PowerPoint: Block diagram + Experiments + Cartoon
1488,Graphic Design: Double Your Sales With Canva
1489,Easy Typography Tips to Beautify and Strengthen Your Work
1490,Adobe Illustrator Advanced Vector Artwork
1491,Web Elements Design With Photoshop
1492,Logo Design Made Easy: Create your own logo in PowerPoint
1493,Typografie - Die besten Schriftarten im Geschäftsalltag
1494,Lettering
1495,Corel Draw x7
1496,Adobe Photoshop CC - Fundamentos
1497,Curso de Diseño e Ilustracion de Armas para Videojuegos
1498,Photoshop - Composição vintage
1499,Photoshop: Automatiza invitaciones con bloc de notas y Excel
1500,Illustrator CC 2016 Power Workshops (Deutsch)
1501,Curso Blender 3D  do Básico ao Avançado 
1502,Diseño impreso - Preimpresión para offset en Illustrator
1503,Fundamentos de la Tipografía - Para un diseño eficaz
1504,الدورة الشاملة illustrator from zero to hero
1505,Designing an eBook Cover that Sells
1506,Master Terrazzo: Creating Vector Tiles with Adobe Illustrati
1507,Paint atmospheric sunset with soft pastel!
1508,Earn and Learn to create Logo designs in Illustrator quickly
1509,Create your own Photoshop brush preset!
1510,Quick and Quirky Caricatures - Learn in an Hour!
1511,Finalize Production Files | Photoshop Illustrator InDesign
1512,How to illustrate in Flash 
1513,OpenCV Computer Vision Application Programming 
1514,Turn your animated greeting card carousel into a music video
1515,Mastering Photoshop Elements 15 Made Easy Training Tutorial
1516,Manipulate Photos with GIMP
