,course_title
2509,The Complete Wordpress Course - Build Your Own Website Today
2510,JQuery Essentials core training for Dynamic Interactive web
2511,Node.js: The Essentials + API Frameworks Express KOA Sails
2512,The Complete PHP Bootcamp Course With Video Sharing Project
2513,Build a Single Page Application with jQuery & AJAX
2514,Practical CSS Website Development: Crash Course 
2515,Successful website creation - everything you need to know
2516,Start Writing JavaScript Today - Beginner JavaScript Course
2517,HTML5 Essentials for Beginners
2518,Code a personal splash page in 1 hour
2519,Step-by-step HTML and CSS for Absolute Beginners
2520,Angular 4 Development Decoded
2521,Javascript ES6! A Complete Reference Guide to Javascript ES6
2522,Reactive JS:  Are you ready for the next big paradigm shift?
2523,Learn Python and Django: Payment Processing
2524,Code your first Website using HTML & CSS: Project Learning
2525,"React.js: Building Production Ready Apps, Start to Finish"
2526,Learn Object Oriented Programming PHP fundamentals bootcamp
2527,Javascript Intermediate level 2 - Mastering Functions
2528,1 Hour CSS
2529,"Become a Full Stack Developer with Spring, AWS and Stripe"
2530,Complete JQuery And JQuery UI Course For Beginner
2531,Learn JavaScript for Web Development
2532,"Complete AJAX Using Bootstrap, PHP From Basic To Advanced."
2533,Complete Wordpress Theme Development Course
2534,How to Optimise Your WordPress Website's Speed & Security to Improve SEO & User Experience
2535,Build A Web App With Spring Framework and Angular 2
2536,Projects in Laravel: Learn Laravel Building 10 Projects
2537,Javascript Intermediate level 3 - JSON
2538,Develop Your First App in an Hour
2539,PHP: Ultimate guide to PHP for everyone
2540,JavaScript DOM Dynamic Web interactive content Boot Camp
2541,"Master JavaScript Programming, 3 Projects Included !!"
2542,HTML CSS Learn to create a website from scratch
2543,Complete Codeigniter: From Beginner to Advanced
2544,HTML 5: How I made websites in HTML5
2545,"Build Responsive Website Using HTML5, CSS3, JS And Bootstrap"
2546,Complete React JS web developer with ES6 - Build 10 projects
2547,Complete WordPress Theme Developer Course With Bootstrap
2548,The Complete Ethical Hacking Course 2.0: Python & Kali Linux
2549,Dynamic JavaScript Master Class AJAX JSON Simple APIs
2550,Vue JS - Mastering Web Apps
2551,Angular NgRx Store Masterclass - Covers Angular 4
2552,JavaScript the Basics - JavaScript for Beginners
2553,"Complete E-Commerce Course - Java,Spring,Hibernate and MySQL"
2554,"Learn SVG Animation - With HTML, CSS & Javascript"
2555,"Build a Responsive Website with HTML5, CSS3 and Bootstrap 4"
2556,CSS Development (with CSS3!)
2557,Angular 2 & TypeScript Beginner Web Development
2558,The Docker for DevOps course: From development to production
2559,"Beginner Full Stack Web Development: HTML, CSS, React & Node"
2560,Learn Angular 2 Development By Building 12 Apps
2561,"Server API Development in Swift, Kitura, & Bluemix"
2562,React VR - Creating Virtual Reality Apps
2563,RxJs & Reactive Programming Angular Masterclass - Angular 4
2564,"Coding for Entrepreneurs: Learn Python, Django, and More."
2565,React and Flux Web Development for Beginners
2566,The Full Stack Web Development
2567,Learn Nodejs by building 12 projects
2568,How to Make an Online Portfolio Website from Scratch 
2569,How To Make A Web Page With No Code
2570,Spring Framework 4 And Dependency Injection For Beginners
2571,Joomla 3 - The Basics
2572,jQuery in Action: Build 8 jQuery Projects
2573,Master WordPress Plugins: Shortcodes Ultimate - The Basics
2574,ASP.NET C# - Enterprise Web Systems From Novice to Expert
2575,Wordpress - Create an Outstanding Website in 2 hours
2576,Complete Website & CMS in PHP & MySQL From Scratch!
2577,The Complete Web Development Tutorial Using React and Redux
2578,Create and Deploy a Web App in 3 Hours
2579,HTML & CSS From Scratch in 30 Days
2580,Getting Started with Craft CMS
2581,JavaScript For Absolute Beginners - Level One
2582,Effective Personal Website Building and Hosting
2583,Web Design for Web Developers: Build Beautiful Websites!
2584,"Learn Rails: Quickly Code, Style and Launch 4 Web Apps"
2585,Getting Started with NodeJS for Beginners
2586,Quickstart AngularJS
2587,Byte-Sized-Chunks: Cascading Style Sheets (CSS) with HTML
2588,Learn Building Your Own Website Without Coding
2589,Practical Guide to Web Development
2590,The Complete HTML5 and CSS3 Course
2591,HTML & CSS for beginners: Build 3 projects from scratch
2592,Code a 'Coming Soon' Landing Page in Bootstrap 4
2593,Introduction to Bootstrap 3
2594,Master ExpressJS to Build Web Apps with NodeJS&JavaScript
2595,Learn XML Crash Course: Discover Essential XML Fundamentals 
2596,HTML5 CSS3 JQUERY Single Page Website Project from Scratch
2597,Scrape Websites using PhantomJS and CasperJS
2598,Amazon s3 Mastery - THE How-To' Guides For Amazon S3
2599,HTML and CSS Crash Course for Beginners
2600,EMMET Faster HTML & CSS workflow - Best Tool For Developers 
2601,Introduction to Web Development
2602,AngularJS For ASP.NET MVC Developers
2603,Serverless Workflow Management with AWS Step Functions
2604,How to set up a Web Server From Scratch to One Fully Managed
2605,The Complete PHP MySQL Professional Course with 5 Projects
2606,Angular Masterclass
2607,Become a Professional Web Developer | Version 3.0
2608,Build Incredible Chatbots
2609,Try Django 1.10 | Create a URL Shortening Service
2610,Projects in CSS
2611,Ruby on Rails: Training and Skills to Build Web Applications
2612,Learn and Understand React
2613,Learn Javascript & JQuery From Scratch
2614,Learn to use JSON
2615,The Ultimate Web Developer How To Guide
2616,"Build A Complete CRUD Application With PHP, MYSQL & JQUERY"
2617,jQuery Crash Course: Learn the Essentials of jQuery Fast
2618,Drupal Tutorial : Drupal 8 Beginner to Expert in 8 PROJECTS
2619,The Complete PHP CodeIgniter Course: Beginner To Advanced
2620,JavaScript For Beginners : Learn JavaScript From Scratch
2621,"Mastering 'Native CSS Shapes To Build Modern Web Pages"""
2622,WordPress Development For Beginners
2623,WordPress local server setup and site migration online
2624,PHP Fundamentals - Start Earning The Top Dollars You Deserve
2625,Interactive Dynamic JavaScript for beginners DOM
2626,Javascript Intermediate level 1 - Mastering the DOM
2627,Sublime Text for Rapid Web Development
2628,Servlets and JSPs Tutorial: Learn Web Applications With Java
2629,Projects in PHP and MySQL
2630,PHP OOP: Object Oriented Programming for beginners + Project
2631,React Redux React-Router: From Beginner to Paid Professional
2632,Django Core | A Reference Guide to Core Django Concepts
2633,"Angular 2 Complete E-Commerce App Course - Java,Spring,MySQL"
2634,"Build An Online Bank With Java, Angular 2, Spring and More"
2635,The Complete jQuery Course: From Beginner To Advanced!
2636,Projects in AngularJS - Learn by building 10 Projects
2637,The Ultimate Vue JS 2 Developers Course
2638,React JS - Build real world JS apps & deploy on cloud
2639,Angular 4 Front To Back
2640,"Modern Web Development with SASS, Gulp, NPM & Web Workflows"
2641,"HTML5, CSS3 And JavaScript Fundamentals 2016"
2642,"Angular 4 - Concepts, Code and Collective Wisdom"
2643,Learn E-Commerce Website in PHP & MySQL From Scratch!
2644,JavaScript Game Development: Create Your Own Breakout Game
2645,HTML and HTML5 For Beginners 2016
2646,A Very Complete Introduction To Laravel
2647,"Learn to code, Become a Web Developer and Master JavaScript!"
2648,Serverless Architecture on Amazon Web Services
2649,jQuery Essentials: Learn the Fundamental of jQuery
2650,Expert Guide : Mastering Functions in JavaScript !
2651,Learn Angular 4 from Scratch
2652,Discover HTML Essential guide to HTML how to create webpages
2653,HTML5 and CSS3 for beginners: Create a Website from Scratch
2654,Introduction to Web Development
2655,jQuery Fundamentals Powerful Bootcamp for beginners
2656,The Complete HTML & CSS Course - From Novice To Professional
2657,JavaScript Basics Web Development Building Blocks
2658,Bootstrap unleash the power faster & easier web development
2659,JavaScript Design Patterns: 20 Patterns for Expert Code
2660,Fix Google's New 'Not Secure' Warning with Let's Encrypt!
2661,JavaScript for Beginners Welcome to learning JavaScript
2662,Benefits of Thinking Mobile First Future of Website Design
2663,Javascript from Beginner to Advanced Level
2664,AJAX Development
2665,Interaction Design Specialist For Web Developers
2666,PHP Security
2667,The Bubble Course - Create Complete Web Apps without Coding
2668,The Complete HTML5 & CSS3 Course Build Professional Websites
2669,CSS Web Development Crash Course
2670,Mastering DevOps
2671,Building Websites Create a fully functional Web contact form
2672,Create a Dynamic User Registration Form from scratch
2673,A 13 Hour SQL Server 2014 /ASP.NET/CSS/C#/jQuery Course
2674,HTML Workshop
2675,Python for Beginners: Python Programming Language | Tutorial
2676,Creating Animations using HTML5 Canvas
2677,Bootstrap 4: Exploring New Features
2678,Bootstrap 3 -> Profitable WordPress Theme Development!
2679,Intro to Git
2680,WordPress Domination #2: Leads & Scarcity
2681,Learn How to Manage & Customize  Web Sites By Drupal CMS
2682,Using Modern JavaScript Today
2683,Up and Running with jQuery
2684,Learn How To Build A Professional Web Site By Using Joomla
2685,Power up HTML5 with JavaScript
2686,Node Package Manager Course: Build and Publish NPM Modules
2687,WordPress Look and Feel with Themes
2688,PHP with Laravel for beginners - Become a Master in Laravel
2689,JavaScript 2017: Become Top Rated Web Developer
2690,The Complete Web Developer Bootcamp - Beginner to Expert
2691,Full-Stack Web Apps with Meteor and React
2692,Angular 4: From Theory to Practice & FREE E-Book
2693,The Complete Sass & SCSS Course: From Beginner to Advanced
2694,Become a Certified Web Developer
2695,Become a Web Developer from Scratch
2696,Ultimate Angular 4 (previously Angular 2) with Bootstrap 4
2697,The Ultimate Beginner's Guide to Django
2698,React JS - Mastering Redux
2699,Professional Ruby on Rails Developer with Rails 5
2700,"Ruby on Rails 5 - BDD, RSpec and Capybara"
2701,Back to School Web Development and Programming Bundle
2702,Complete ASP NET MVC Web Development - Newbie to Ninja!
2703,The Complete DevOps Engineer Course 2.0 - Java & Kubernetes
2704,All about NodeJS
2705,How To Create A Wordpress Website 2016 | NEW Divi Theme 3.0!
2706,The Complete jQuery Course - From Beginner to Professional!
2707,Build a complete Fiverr clone with Node + Algolia + Paypal
2708,The Ultimate Web Development Course
2709,React From The Ground Up
2710,Javascript for Beginners Learn by Doing Practical Exercises
2711,8 Beautiful Ruby on Rails Apps in 30 Days & TDD - Immersive 
2712,Wordpress Website Mastery 2017
2713,How To Make an eCommerce Website With Wordpress 2017
2714,Mastering ASP.NET MVC 5 From Scratch Using C#
2715,Start Web Development with GIS Map in JavaScript
2716,Learn to Build Websites using Twitter Bootstrap
2717,Web Development Tools the Pros Use: Code Productivity Hacks
2718,WordPress : An Overview
2719,Create Startup Landing Page with Viral Marketing Strategies
2720,JavaScript : JavaScript Awesomeness
2721,Mastering CSS 3.0 Selectors
2722,WordPress Backup And Restore Fundamentals
2723,Learn HTML and CSS to make a Website
2724,1 Hour HTML
2725,Angular 2 Crash Course with TypeScript
2726,Boost your website speed without any coding!
2727,Professional Rails Code Along
2728,ASP.NET Web API 2 Hands-On
2729,Create a MEAN App by Example - Full Stack Course
2730,The Original Complete Web Developer Course.
2731,Angular 2 From The Ground Up
2732,Complete Web Development Course + Building 5 Websites!
2733,WP Plugin Development - Build your own plugin!
2734,Sass: From Beginner to Advanced
2735,Build Flat Responsive Website from Scratch - Complete Course
2736,Wordpress for Beginners - Build a Live Website from Scratch
2737,"Essential JavaScript, jQuery and AngularJS Training"
2738,The Pro Ruby on Rails Starter
2739,Unit Testing AngularJS: Build Bugfree Apps That Always Work!
2740,WordPress Blog : Create a WordPress Website for Beginners
2741,Introduction to HTML5 Canvas basics of drawing
2742,"Thoughtful Web Development Course: HTML, Vue.js, PHP, MySQL"
2743,Kids Coding - Beginners CSS
2744,PHP & MySQL - Learn The Easy Way. Master PHP & MySQL Quickly
2745,Learning Path: Magento: Master and Test Magento 2 with Ease
2746,The Complete hapiJS Course - Go From Beginner To Advanced!
2747,Ruby On Rails For Web Development
2748,Create eye-catching WordPress website from scratch
2749,Become A Web Developer And Seller - Build Websites With HTML
2750,WordPress Tips and Tricks
2751,HTML Tutorials : HTML Code for Website Creating
2752,Complete HTML5 and CSS3 Course +1 Start to Finish Project
2753,Web Development With HTML CSS BOOTSTRAP JQUERY for Beginners
2754,HTML5 Specialist: Comprehensive HTML5 Training
2755,CSS and CSS3 For Absolute Beginners
2756,Build a Complete JQuery Plugin (Image Pop-up Dialog)
2757,How to create HTML Forms
2758,ReactJS and Flux: Learn By Building 10 Projects
2759,How To Make A Business Website In 1 Day With Wix FAST & EASY
2760,PHP Date and Time Course by Edwin Diaz
2761,Start Your Own Forum Website in 15 Minutes 
2762,Hit the ground running with AngularJS with Dion Yang
2763,Learn CSS Transition and Animation 
2764,Learn JavaScript from scratch
2765,WordPress for Beginners - Tutorial - From Novice to Know-How
2766,RESTful API with Laravel
2767,Learn Ruby on Rails for Absolute Beginners
2768,JavaScript Tutorial
2769,Shopping Cart Website from Scratch Ecommerce
2770,Learn By Example: Angular JS
2771,The Complete front end web developer Bootcamp - 14 projects
2772,WordPress LMS: E-Learning Website Made Easy
2773,Create An HTML5 Video Player From Scratch
2774,In Depth Web Development Made Easy
2775,Jquery :basics for beginners
2776,Web Development By Doing: HTML / CSS From Scratch
2777,Build Your First Website in 1 Week with HTML5 and CSS3
2778,"ASP.NET Core MVC, Quick and Practical"
2779,Better way towards CSS using Less and Sass
2780,JavaScript Complete for beginners with real world Apps
2781,Creating a Responsive HTML Email
2782,Angular 2 Demystified
2783,Learn HTML Fast and Easy!
2784,How To Setup a Micro-Blog in 3 Easy Steps
2785,Ruby on Rails for Complete Beginners
2786,Wordpress for Non-Technical People
2787,ASP NET CORE - ANGULAR 2 E-Commerce App
2788,Introductory JavaScript Made Easy Training Tutorial
2789,Become a Heroku Rails Ninja: Expert Level Deployment Tools
2790,Complete RESPONSIVE Website Design with HTML5 & CSS3
2791,Pimcore Developer: Implement a Blog from a Bootstrap Theme
2792,Inspirational Web Development - A Beginner Approach -
2793,"Learn HTML, A practical guide from scratch to HTML 5"
2794,JavaScript Tutorial: Learn JavaScript Code for Beginners
2795,Website Secrets: Get a Gorgeous Website on the Cheap
2796,Ultimate WordPress Plugin Course
2797,PHP for Beginners: How to Build an E-Commerce Store
2798,"Build Realtime Apps | React Js, Golang & RethinkDB"
2799,"Master Electron: Desktop Apps using HTML, JavaScript & CSS"
2800,The Complete Web Developer Masterclass: Beginner To Advanced
2801,Mastering Micro Services Using Java Spring Boot
2802,How to Create A Website: An HTML Tutorial and CSS Tutorial
2803,The Advanced Web Developer Course
2804,Projects in MongoDB - Learn MongoDB Building Projects
2805,Learning JavaScript Programming Tutorial. A Definitive Guide
2806,"The Complete JavaScript, HTML and CSS Tutorial For Beginners"
2807,"Build Modern Responsive Website With HTML5, CSS3 & Bootstrap"
2808,The Complete JavaScript Course For Web Development Beginners
2809,Email Marketing: Send Unlimited Emails via Own Mail Server
2810,Getting started with JavaScript
2811,Learn the basics of the Web development: Coding Tactics
2812,RESTful API with Laravel 5.4: Definitive Guide
2813,Learn AngularJS Step By Step
2814,Learn React : The World's Most Lucrative JavaScript Library
2815,Master Regular Expressions from scratch - All languages
2816,Try AngularJS: Beginner's Guide to Front End Web Development
2817,JavaScript Step by Step how to apply it to your web pages
2818,Explore JavaScript Beginners Guide to Coding JavaScript
2819,Learn Web Scraping with Node.js
2820,Getting Started with WordPress 2016
2821,Learn HTML5 Programming From Scratch
2822,Getting Started with LESS - Beginner Crash Course
2823,Master ECMAScript 2015 (ES6)
2824,Learn to Setup Websites from Scratch
2825,Create Fast RESTful APIs with Lumen and Homestead by Laravel
2826,"Build Modern Websites Quick With HTML,CSS and Bootstrap"
2827,Twitter Integration customize Tweets with developer API
2828,Build a Responsive Website with a Modern Flat Design
2829,The Ultimate WordPress Boot Camp: Build 7 Websites
2830,Master the Basics of HTML5 & CSS3: Beginner Web Development
2831,Become A Full Stack Web Developer in 14 Days
2832,Projects In ReactJS - The Complete React Learning Course
2833,Beginning Web development Learn the basics of HTML
2834,Step by Step Build Your Template by Bootstrap 4 from scratch
2835,Hosting your static website on Amazon AWS S3 service
2836,JavaScript Rockstar How to create Incredible Useful code
2837,Spring Core DevOps on AWS
2838,How to Create a Website Without Coding - WordPress 2016
2839,PHP Graphic Techniques: CAPTCHA/ Create a verification code
2840,Introductory To HTML and CSS
2841,Learn how to convert PSD to HTML and CSS responsive
2842,PHP User Login Registration Script With All Features
2843,AJAX : Let's build a COOL project
2844,Advanced WordPress Topics: Post Types Taxonomies & Metaboxes
2845,Laravel Homestead
2846,The Complete TypeScript Programming Guide for Web Developers
2847,JavaScript with BackboneJS and Bootstrap CSS - Advanced
2848,Ruby on Rails Tutorial: Learn 6 Ruby on Rails SEO Techniques
2849,XML DOM :basics for beginners
2850,Learn HTML Basics From Scratch
2851,Byte-Sized-Chunks: Dynamic Prototypes in Javascript
2852,Build Websites from Scratch with Squarespace
2853,Introduction to web programming for GIS applications
2854,Java Spring Security
2855,Responsive Html5 Theme Development
2856,What’s New in Bootstrap 4
2857,ReactJS Course: Learn JavaScript Library Used by Facebook&IG
2858,Building a Ruby on Rails Application with Neo4j
2859,Sara Learns to Code.  Making an App from Scratch
2860,Ajax  for Beginners: A Very Basic Introduction
2861,Wordpress Essentials: Useful Plugins
2862,Django by Example
2863,Build A Great Wordpress Website For Your Business in 2 Hours
2864,Wordpress on AWS: The Easy way to AWS for Free Fast hosting 
2865,Mastering TypeScript
2866,Mastering AngularJS UI Development
2867,Custom Theme Creation for WordPress using HTML5 and CSS3
2868,Create a PHP Contact Form in Bootstrap
2869,Introduction To Data Analytics Using Microsoft Power BI
2870,HTML Made Simple For Beginners: Create a One Page Website
2871,The Complete Web Developer Masterclass: Beginner To Advanced
2872,Website Builder Software Previews
2873,Learn How to Create Your Own Social Network
2874,"Learn By Example: The Foundations of HTML, CSS & Javascript"
2875,JavaScript manipulation of the DOM Document Object Model
2876,Create Jekyll blog and host it on Github like a Ninja
2877,Learn React JS from scratch
2878,Web Security: Common Vulnerabilities And Their Mitigation
2879,PHP for Beginners
2880,Make a professional website - 30 Day Guarantee. Discounted!
2881,Symfony 3: Build a PHP Application with Symfony
2882,Learn ASP.Net Web API 2 for Absolute Beginner
2883,Build a Website in 30 Minutes
2884,Google Blogger : How to Create a Blog
2885,How to Make a Website Without Coding- WordPress & Web Skills
2886,Learn WCF And Web APIs From Scratch
2887,How To Build A Website From Scratch + Blogging Blueprint
2888,Learn To Create Different Website Layouts & Media Queries 
2889,Build Sign Up and Login Forms With Bootstrap Modal
2890,"Build a Real Time web app in node.js , Angular.js, mongoDB"
2891,Superb jQuery Course - Become Certified jQuery Developer
2892,How To Build A Facebook Messenger Chat Bot From Scratch
2893,"Build Your Own Calculator App with Javascript, HTML5 & CSS"
2894,The Complete WordPress Development & Customization Course
2895,HTML CSS Easy steps to create a web template from scratch
2896,Learn jQuery AJAX in 1 hour
2897,Develop Competitive Plugins for WordPress and WooCommerce
2898,Get Results - Core Principles of Web Development Tricks Tips
2899,JSON Faster Sleeker & Easier Discover the benefits learn it
2900,Get to know HTML Learn HTML Basics
2901,Ultimate Css & JQuery Form Designing From Beginner to Expert
2902,PHP: Complete Registration and Login with Email Verification
2903,JavaScript from Beginner to Expert
2904,Build a website HTML5 CSS3 Beginner Course
2905,Learn Ruby on Rails: Stripe Payment Processing
2906,WordPress For Beginners | No Coding Required
2907,jQuery For Beginners : A Basic Introduction
2908,WordPress Plugins and Widgets
2909,PHP Essential How to create build Amazing websites with PHP
2910,HTML CSS JavaScript: Most popular ways to code HTML CSS JS
2911,Bootstrap 3 Beginners: Create a Professional Landing Page
2912,Introduction to Node.js for Beginners
2913,Introduction to Coding with Ruby
2914,Complete PHP and MySql Course: From Beginner to Professional
2915,Angular JS Essentials
2916,How To Setup Web Hosting
2917,"Web Application Development using Redis, Express, and Socket"
2918,How to Start a WordPress Blog - Complete Beginners Guide!
2919,CSS3 Gradients for Web Designers
2920,Learn ASP NET MVC 5 step by step
2921,Tumult Hype Pro Basics: HTML5 Animations Made Easier
2922,Web Hosting Set Up and WordPress Installation For Beginners
2923,Ruby on Rails 4---A Test-Driven Approach
2924,AJAX :basics for beginners
2925,Let's JavaScript!  Code a calculator
2926,JavaScript from Beginner to Advanced
2927,WordPress Theme Academy with Bootstrap
2928,Building a eCommerce Startup in 4 Hours [Livestream]
2929,Responsive PHP Registration Form: From Scratch
2930,A-Frame WebVR Programming Tutorial Series (Virtual Reality)
2931,Learn Bootstrap And Make Responsive Websites
2932,HTML Web Development Crash Course
2933,Bootstrap Basics: Program Responsive Websites
2934,Projects with JSON and APIs
2935,Web Design HTML CSS How to Create a Website from Scratch
2936,"Create Complete Sign up System using PHP, jQuery and Ajax"
2937,Adobe Flash for Beginners - Build Flash Website From Scratch
2938,Learn Complete WordPress for Building a Professional Sites
2939,Devtools 2017: Beginner to Expert w/ Chrome Developer Tools
2940,Bootstrap Essential Training - Create Your Very Own Website
2941,Angular 2 Jump Start With Typescript
2942,Learn Plugin Development in WordPress By Building  Projects
2943,"Build Your Startup with No Coding (Design, Develop & Ship)"
2944,The Web Developers Guide: Learn HTML & CSS Fundamentals
2945,Learn PHP Programming for Absolute Beginners - Lite
2946,Learn Drupal 8 - With a Live Project
2947,Supreme NodeJS Course - For Beginners
2948,CSS3 for beginners
2949,Javascript for beginners
2950,Become a Bootstrap Expert: Build 20 Layouts!
2951,PHP : Learn to upload files to Amazon S3 and use CloudFront
2952,PHP MySQL: Learn PHP MySQL with Project
2953,How to Set Up a Self-Hosted Wordpress Website in 30 Minutes
2954,Projects in Django and Python
2955,"Create, Update and Manage Your Own Website Using Drupal 7"
2956,Learn HTML - The programming language to build a webpage!
2957,Learn To Program JavaScript (in ten easy steps)
2958,Bootstrap :basics for beginners
2959,Introduction to CSS Development
2960,PHP :basics for beginners
2961,Beginning Oracle WebLogic for Administrators
2962,Build an HTML5 and CSS3 Website in 35 Minutes
2963,Angular 2 Routing: Up And Running
2964,Advanced Prezi: Make Amazing Presentations 
2965,1 hour jQuery
2966,The WpFASTER WordPress Speed Optimization Master Course
2967,How to Build Your Own Website with WordPress: A Step-by-Step Guide 
2968,Build Apps with ReactJS: The Complete Course
2969,Learn SASS: from beginner to expert
2970,The complete HTML5 course
2971,Create a Responsive Website with Bootstrap 3
2972,Lerning PHP by building website
2973,Learn PHP Object Oriented Features with Simple Examples
2974,Crash Course - Learn to Create a PHP MVC Framework
2975,JSON :basics for beginners
2976,CSSCasts; CSS libraries Plugins Tips & Tricks for Developers
2977,Complete Guide to Front-End Web Development and Design
2978,"Build Ajax Web Apps with Laravel 5.2, Bootstrap and jQuery"
2979,Javascript for Beginners
2980,MongooseJS Essentials - Learn MongoDB for Node.js
2981,Regular Expressions for Beginners - Universal
2982,Learn Redis from Scratch
2983,WordPress Plugin Development -> Deep dive discovery!
2984,Learn Ajax and jquery with PHP
2985,Create a business website with WordPress
2986,DesktopServer : Install WordPress Locally  - Work Anywhere!
2987,Understand PHP Arrays and HTTP Request in a Better Way
2988,Mastering CSS
2989,The Complete Wordpress Theme Development Guide
2990,The Complete HMTL5 Course - Go From Beginner To Advanced!
2991,Learn Jquery from Scratch 2-Hour Training 
2992,How to Create a Wordpress Website from Scratch - No Coding
2993,Learn PHP CodeIgniter Framework with AJAX and Bootstrap
2994,The Complete Guide to JavaScript Development
2995,Basic HTML CSS and Web Design
2996,Build Professional WordPress Website
2997,Ultimate CSS3 Course - From Beginners To Professional
2998,Code & Grow Rich:  Earn More As An Entrepreneur Or Developer
2999,Learn by Example : ReactJS
3000,React.js Quickly: Developing Scalable Web User Interfaces
3001,JavaScript - Tricks and Workarounds
3002,Kids Coding - Beginner HTML
3003,Learn PHP from scratch!!
3004,PHP with PDO - ULTIMATE Crash Course
3005,JavaScript for beginners with live examples
3006,Bootstrap 3 Introduction : Create RESPONSIVE Websites Fast
3007,Laravel(5.2) PHP Framework  Jump Start for beginners
3008,Professional WordPress Theme Development For 2017
