,course_title
0,Ultimate Investment Banking Course
1,Complete GST Course & Certification - Grow Your CA Practice
2,Financial Modeling for Business Analysts and Consultants
3,Beginner to Pro - Financial Analysis in Excel 2017
4,How To Maximize Your Profits Trading Options
5,Trading Penny Stocks: A Guide for All Levels In 2017
6,Investing And Trading For Beginners: Mastering Price Charts
7,"Trading Stock Chart Patterns For Immediate, Explosive Gains"
8,Options Trading 3 : Advanced Stock Profit and Success Method
9,The Only Investment Strategy You Need For Your Retirement
10,Forex Trading Secrets of the Pros With Amazon's AWS
11,Trading Options With Money Flow
12,Financial Management Risk and Return For Securities
13,Forex Trading Course: Work Smarter Not Harder Proven Results
14,Python Algo Trading: Sentiment Trading with News
15,Short Selling: Learn To Sell Stocks Before The Fall
16,Basic Technical Analysis: Learn the structure of the market
17,The Complete Chart Pattern Trading Course: A Proven Approach
18,7 Deadly Mistakes of Investing that Will Slash Your Profits!
19,Financial Statements Made Easy
20,Winning Forex Trading with Live Forex Trading Examples
21,Forex Traders - Create Your First Trading Robot. No Coding!
22,Create A Business From Home Trading Stocks Today In 2017
23,Introduction to Accounting : Mastering Financial Statements
24,The Complete Ethereum Course: Get .01 Ether In Your Wallet
25,Beginner to Pro in PowerPoint: Complete PowerPoint Training
26,Investing 101: The Complete Online Investing Course
27,Create Your Own Hedge Fund: Trade Stocks Like A Fund Manager
28,Learn MQL5: Build an 8-Currency Hedging Robot (MetaTrader 5)
29,Forex Trading: Your Complete Guide to Get Started Like a Pro
30,Python Algo Stock Trading: Automate Your Trading!
31,THE Forex Robot: Incredible ROI (Robot Included)
32,The Complete Bitcoin Course: Get .001 Bitcoin In Your Wallet
33,Mastering High Probability Iron Condor Options Trading
34,The Complete Short Course on Ethereum
35,Options Trading Stocks: Proven Toolbox For Financial Success
36,Forex Trading A-Z™ - With LIVE Examples of Forex Trading
37,"Introduction to Finance, Accounting, Modeling and Valuation"
38,Beginner to Pro in Excel: Financial Modeling and Valuation
39,The Complete Investment Banking Course 2017
40,The Complete Financial Analyst Course 2017
41,Python for Finance: Investment Fundamentals & Data Analytics
42,Financial Modeling for Startups & Small Businesses
43,Options Trading - How to Win with Weekly Options
44,Black Algo Trading: Build Your Trading Robot
45,Accounting & Financial Statement Analysis: Complete Training
46,Cryptocurrency Trading: Complete Guide To Trading Altcoins
47,Forex Robots: Expect To Earn 175% P.A. Forex Robot Included!
48,Three Steps Trading - Live Trading - Real Account
49,Option Trading for Rookies:  Understand Options Completely
50,How I Learned Stock Trading (and How You Can Too)
51,Learn to Trade for Profit: Find and Trade Winning Stocks
52,Trading Inside Bars - Master 1 Easy Pattern To Be Successful
53,Four Fundamentals of Financial Planning
54,Options Trading - Calendar Spread Course for Every Trader
55,Dividend Investing: Build Your Portfolio for a Better Future
56,Learn Accounting. Understand Business.
57,How to Consistently Win Trading Stocks in 30 Days or Less
58,A Beginner's Guide to Quantopian Futures API
59,How to Buy Cheap Options - Options Trading Pricing Model
60,Excel Crash Course: Master Excel for Financial Analysis
61,"Comprehensive Guide to Financial Markets, Investing &Trading"
62,Stock Trading Ninja: Complete System For Trading Success
63,Hedge and Mutual Fund Careers: The Complete Guide
64,Algorithmic Trading In Forex: Create Your First Forex Robot!
65,The Power Modeling Bootcamp: Advanced Excel in 10 Days
66,Options Trading Basics (3-Course Bundle)
67,How to Win 97% of Your Options Trades
68,How I Make Consistent Returns Trading Options
69,"Forex Strategies: Kelly Criterion, Larry Williams and more!"
70,"Elite Trend Trader: Learn To Trade Stocks, Options & Forex"
71,Options Trading Introduction: Day Trade Stock Options
72,The Almost Perfect Options Trading Strategy System - Unique
73,Forex Trading -  Learn to Trade Forex Like the Banks
74,Learn to Trade for Profit:Trading with Japanese Candlesticks
75,The Most Powerful Options Spread Trading Front Ratio Spread
76,What Finance Job is for You? Explanation of 14 Finance Roles
77,The Blueprint for Successful Stock Trading
78,Trading for Beginners - Intermediate Level
79,Start Trading Stocks Using Technical Analysis!
80,Learn How to Set Up an Incubator Hedge Fund - Step-by-Step
81,VPS for Forex Trading - Protect Your Forex Robots
82,Introduction to Accounting: The Language of Business
83,Basic Excel for Basic Bookkeeping and Accounting
84,"Using 'The Greeks To Understand Options"""
85,Trading Options For Consistent Returns: Calendar Spreads
86,How to Create Your Personal Budget
87,The Complete Value Investing Course: A Proven Approach
88,FOREX Trading with Price Action
89,Emini ES Futures - Advanced Non Directional Options Trading
90,Forex Trading - Advanced Fundamental Analysis
91,How To Invest With Tiny Capital In Stocks ?
92,Learn How To Successfully Trade Stocks: In 5 Simple Steps
93,Forex MetaTrader 4: Master MT4 Like A Pro Forex Trader
94,Intermediate Options trading concepts for Stocks and Options
95,Options Trading 101: The Basics
96,Practical Accounts APP Overview
97,Bitcoin Profits for Beginners
98,Trend Traders Club: How To Find And Trade Fast Moving Trends
99,Financial Statements Basics
100,High performance Stock Trading using key Options techniques
101,Introduction to Financial Statement Analysis
102,Basics of Economics (College Level)
103,Stock Market Investing for Beginners
104,Accounting for Beginners : Learn Basics in under 1 Hour
105,Straddle Options Trading - Profit in Any Market Direction
106,Fundamentals of Forex Trading
107,"Binary Options: Trading Strategies, 90% Accuracy and Signals"
108,Website Investing 101 - Buying & Selling Online Businesses
109,Practical Accounts & Bookkeeping Automated Overview 
110,Live Account - ETF Trading System - Hacking The Stock Market
111,Stock Market Leverage: How to Start Trading Options Wisely
112,Stock Market Foundations
113,Crash Course on Working Capital Management
114,Advanced Accounting A Complete Study for CA / CMA / CFA / CS
115,61% Profit In 1 Month - Crush Your Forex Trading Paradigm
116,How to create a routine Trading
117,"Forex Trading Secrets |MT4 Robot (EA) inside, no coding"
118,Forex SOS Course: Trading Tweaks And Working Forex Strategy
119,Introduction to Financial Modeling
120,Quantitative Aptitude for Banking & Competitive Examinations
121,Option Spreads and Credit Spreads Bundle
122,B Com Accountancy I (Paper ECO 02 IGNOU)
123,FOREX TRADING - Learn in a quick + profitable way + support
124,Auditing Basics (Professional Course Level)
125,Stock market Investing Encyclopedia: How to invest in stocks
126,Learn the basics of preparing accounting statements
127,Elliott Wave -Forex Trading With The Elliott Wave Theory
128,Corporate Finance - A Brief Introduction
129,Excel functions to analyze and visualize data
130,Building Financial Statements in Excel
131,Transfer Pricing A Complete Analysis
132,Accounting: Get Hired Without Work Experience
133,Forex Trading for Beginners - Basics
134,Basic Bookkeeping Hacks
135,Complete Trading Plan Course for Stocks & Forex (10 Hours)
136,"Forex Trading with Fixed 'Risk through Options Trading"""
137,"Intro to Investment Banking, M&A, IPO, Modeling + Free Book"
138,How to Pick The Right Penny Stocks To Invest In 2017
139,Top 10 Trading Ideas in the Equities Market
140,Intro to Financial Modeling
141,Shark Accounting - Building a Business by the Numbers!
142,Forex Trading MAKE YOUR FIRST TRADE TODAY!
143,Accounting in 60 Minutes - A Brief Introduction
144,SAP FICO For Beginners - A Guide to SAP Financial Accounts
145,Learn how to double your Forex Trading Account in one trade
146,"Accounting Superpowers: Learn Accounts, Understand Business!"
147,Python Algo Trading: FX Trading with Oanda
148,Save on Your Taxes
149,Financial Model Basics: Build a model from start to finish
150,Option Trading for Rookies: The Covered Call Option Strategy
151,EFT for Stock Options Trading Success & Making Better Trades
152,Learn to Trade the Stock Market without Blowing Your Profits
153,Get a Credit Repair Publication On Amazon and Live LIFE..
154,Fundamentals of Accounting
155,"RSI, Options Trading & Technical Analysis (3 Course Bundle)"
156,Basics of Mutual Funds for CA / CMA / CS / CFA Exams
157,Accounting 101: How to read an Accounting Balance Sheet
158,Stock Options Day Trading Mindset for Success
159,Introduction to bookkeeping and Accounting
160,Learn to Trade The News
161,"Value Investing, Taught by Six Superinvestors"
162,Trading for everyone - The Independent Investor Course I
163,Get Acquired: Learn From The Head Of Acquisitions For eBay
164,Stock Market investment: Practical Accounting
165,"How to remove 'Risk from Penny Stocks - Options Trading"""
166,Accounting Basics in 66 Minutes (absolutely for beginners)
167,"Tax Accounting: Difficult Topic, Made Easy to Understand"
168,Analysis of Company Financial Statements
169,Forex Trading Like Banks – Step by Step with Live Examples
170,Fundamentals of Investing!
171,Bank Financial Management A Comprehensive Study
172,Learn to Trade Forex and Stocks: From Beginner to Advanced
173,"Master 'Technical Analysis and Chart reading skills Bundle"""
174,Naked Put Options Trade Covered Call & Poor Man Covered Call
175,The Ultimate Guide to Dividend & Dividend Growth Investing
176,Charting for Beginners 101: Technical Analysis Demystified
177,Build a DCF Valuation Model
178,Introductory Financial Accounting
179,Introduction to Cryptocurrencies and Blockchain
180,Trade Pullback Candlestick Strategy - Make Consistent Pips
181,Accounting Standards Basics (Professional Course Level)
182,Use the Magic Multiple Moving Average Forex Trading system
183,QuickBooks 2015 Training for Newbies
184,TRADING PSYCHOLOGY: Trading Mindset Mastery
185,Option Trading: How to Adjust Delta-Neutral Strangles!
186,Profitable binary option trading strategy
187,Tax Strategy: Financial Planning for Beginners
188,Accounting 2 Simplified for You
189,Project Funding Modelling (for Professionals)
190,Investing: How I Consistently Beat The Stock Market
191,Bookkeeping Basics:  Understand the Fundamentals
192,Leasing - A Comprehensive Study (Professional Course Level)
193,Trading Options For Consistent Returns: Options Basics
194,TechniTrader Leading Hybrid Indicator Trading
195,Financial modeling: Build a DCF equity valuation model
196,CryptoArbitrager: Bitcoin Trading Robot (no mining)
197,Accounting Is Easy (for Beginners)
198,Non Directional Weekly Options Trading System - ETF & Emini
199,The Complete Position Trading Course: Position Trading Stock
200,Master Iron Condors - Double the credit for half the risk
201,Basics of investing in Mutual Funds
202,A Value Investing Approach to the Stock Market
203,Learn how to INVEST for huge profits or make it big trading!
204,"How to Fund your Million Dollar Idea: Equity, Debt, Unfund"
205,Mastering Candlestick Charting : High Probability Trading
206,Binary Options Course - Level 2
207,Stock Technical Analysis with R
208,"Get to know the VIX Index (aka 'The Fear Index)"""
209,Apply finance concepts for smart project management
210,Introduction to Futures Trading and Live Trade Demonstration
211,Crowdfunding to Win
212,Comprehensive Forex Mastery Program
213,Preparation of Consolidated Financial Statements (Basic)
214,Succeed in Bonds Even if You Don't Know Where to Start
215,Learn to Trade for Profit: Ten Most Profitable Trading Rules
216,Succeed in Lotto Even if You Don't Know Where to Start!
217,CFA Corporate Finance Level 2
218,Pin Bars: The Most Powerful Forex Trading Signal
219,Stock Options Trades Using Interactive Brokers
220,Introduction to Options - Strategies For Consistent Profits
221,Risk in Forex Transactions - for CA / CS / CFA exams
222,Basics of Business Statistics (College Level)
223,"Trading Seasonal Price Patterns in Stocks, Futures, & Forex!"
224,Interpreting Financial Statements
225,Introduction to Bookkeeping (Accounting)
226,CREDIT SPREAD SURGERY - Bear Call and Bull Put Mastery 
227,Investment Banking: How to Land a Job on Wall Street
228,Learn To Invest In Index Funds and ETFs In 7 Easy Steps
229,Financial modeling: Build a multiples valuation model
230,Trade Recap I - A Real Look at Futures Options Markets
231,Advanced Stock Options for Serious Equity Investors!
232,Trading Binary Options for Fun and Profit
233,CFA: Fast Track your career in Finance
234,How to be a Profitable Forex Trader
235,Excel Dashboard - Interactive Excel Dashboard and Charts
236,Accounting 101: Learn Business Finance Forecasting in 60mins
237,The Securities Trade Lifecycle
238,Double your Forex Account using the MAGIC MA trading robot
239,Technical Analysis 101: How to Profit During Market Crashes
240,Advanced Accounting for Investment Banking
241,Investing In Stocks With 10 Simple Rules
242,Venture Capital. What is it and Why it Matters to You!
243,Cash Flow Valuation: Develop Your Financial Literacy
244,Direction-Independ Trading - Elite Forex Traders  Strategy
245,How to Become a Financial Analyst from Scratch!
246,First Steps to Trading the Forexmarkets : Technical Analysis
247,Financial analysis: Compare performance of companies
248,Forex for Beginners: Easy Forex Trading for Beginners
249,Investment Crowdfunding 101 (a.k.a Equity Crowdfunding)
250,Read financial statements like a pro
251,10 Numbers Every Business Owner Should Know
252,Learn How To Trade Gold In 2017
253,IAS 18 - Revenue
254,Forex Trading: The High ROI Forex Trading End of Day Course
255,Fundraise the Simplified Way: A Crowdfunding Blueprint
256,Fundamentals of Accounting for Business Owners
257,Practical Financial Statement Analysis
258,Forex Management - Detailed Study for CA / CS / CFA Exams
259,Financial Statement Review 101:  How to Find Errors
260,Professional Risk Manager (PRM) Certification: Level 1
261,International Tax  - Tax Beyond boundaries
262,The Complete Financial Statement Analysis Course
263,Advanced Excel functions
264,Penny Stocks Value & Chart Pattern Trading (2 Course Bundle)
265,Candlestick Analysis For Professional Traders
266,Build A Career In Forex Trading- Learn Fundamental Analysis
267,Financial Modeling: Build a Complete DCF Valuation Model
268,Hands-on Financial Modeling (With 6 Excel Templates)
269,CAIIB Advanced Bank Management (Part I)
270,Stock Market investment:Non financial fundamental analysis
271,Learn How to Play CashFlow Game
272,Basics of Business Finance
273,Accounting Made Easy 2
274,"Bitcoin: el futuro del dinero, hoy"
275,Aprende a invertir practicando
276,Trading con retrocesos de Fibonacci
277,Mit Finanzwissen zu besserem Unternehmertum
278,Como hacer empresa en 10 sesiones prácticas
279,المحاسبة للإداريين و غير المحاسبين
280,株式投資で本当のファンダメンタル分析ができるようになる
281,Curso de Trading práctico basado en casos reales
282,Curso Avanzado de Trading
283,สอนเทรดไบนารี่ อ๊อฟชั่นอย่างง่าย
284,MQL4 Tutorial Golden Goose
285,Análise de Concessão de Crédito
286,Technical Analysis Using Elliott Wave Theory
287,The Basics Of Volume Analysis
288,Crash Course on Cost of Capital and Capital Structuring
289,Business Accounting Made Easy
290,Build a DCF Model from Scratch
291,"Multiply your returns using 'Value Investing"",https://www.udemy.com/multiply-your-returns-using-value-investing/,true,20,1942,19,63,All Levels,4.5 hours,2015-07-23T00:08:33Z
874284,Weekly Forex Analysis by Baraq FX"""
292,Technical Analysis - A practical approach for trade entry
293,Mastering Technical Analysis : Maximizing Trading Profits
294,The Complete Guide to Professional Trading with Elliott Wave
295,A Complete Guide to Becoming a Trader on the Forex Market
296,Stock Market for Beginners - Complete Starter Toolkit
297,Beginners Binary Options Course
298,Technical Analysis 101: Secrets of Trading Revealed
299,Forex: What's a Trend and When it is Strong and Reliable
300,Volatility Trading Analysis with R
301,How To Profit From Stock Market Volatility
302,Awaken the Accountant in You | Master the Accounting Basics
303,WE WILL PAY YOU TO TRADE WITH US
304,Situational Trading: Proven Option Strategy for any Scenario
305,Portfolio Management for CA / CS / CFA exams
306,Algorithmic Trading in MATLAB: WFAToolbox App GUI (Finance)
307,Finding an Unlimited Amount of Investors
308,Bookkeeping Made Easy
309,BITCOIN VISUALLY. Part I.
310,Learn and Master the Basics of Finance
311,FOREX : LearnTo Trade the Improved ( Advanced ) Patterns
312,Mastering the Market : (Technical Analysis + Candlestick)
313,Mastering Countertrend Trading : High Profit Trading Pattern
314,Exam 1 Review - Managerial Accounting (U of H)
315,* An Integrated Approach to the Fundamentals of Accounting
316,Get to grips with the CFA calculator
317,Financial Model Fundamentals-Learn the Essential Skills
318,Forex: Economic News Trading
319,Analyze Real Estate Investments | Financial Modeling
320,Forex For Beginners - A Guide To Currency Trading
321,Raise Your Credit Score to 800 Or More....
322,Financial Management Budgeting Techniques
323,Forex Killing Divergence - How to trade with precision
324,Working Capital Management for CA / CFA / CPA Exams
325,Risk Analysis - Capital Budgeting for CA / CS / CFA exams
326,Corporate Finance 101: Financial Statement Analysis & Ratios
327,Mastering Futures Options for Beginners - Your Top 5 Plays!
328,"Professional Options Trading, Simplified"
329,"Advanced Options Concepts - Probability, Greeks, Simulation"
330,Accounting Basics - A Complete Study
331,Case Studies in Macro Economics
332,My Forex Strategy that win consistently over and over
333,Understand Banks & Financial Markets 
334,Stock Technical Analysis with Python
335,How to Become an Accountant from scratch!
336,How to invest in Gold
337,Automate Your Finances
338,MBA Accounting and Finance for Managers(Paper MS04 of IGNOU)
339,Accounting Made Easy: A Quick Guide to Financial Accounting
340,Futures/Commodity Training (Basics)
341,Cost Accounting Marginal Costing Theory and Practice
342,The Big Volatility Short: The Best Trade On Wall Street!
343,Master Finance in Three Hours
344,Learn Options on Futures for Hedging Options and Stocks
345,Option selling trading as income source. Beginners friendly
346,Introduction to Value Growth Investing
347,Become A Forex Trader - Forex trading like a professional
348,Hedge Fund Trading System
349,Bulletproof Personal Finance: Expert Asset Allocation
350,Financial Accounting: The Complete Introductory Crash Course
351,Learn About Trading Options from a real wallstreet trader
352,Forex Rate -Why it fluctuates -for CA / CMA / CS / CFA Exams
353,How to Build a Massive Stock Portfolio from Zero!
354,Introductory Forex Trading Course
355,Budgeting Hacks to Build Wealth!
356,Accounting and Finance for Bankers - A Comprehensive Study
357,Forex Prep Academy for Beginners-Real trades!
358,Accounting for Deferred Taxes (Professional Course Level)
359,TRADING TRUTHS
360,The Binary Institute - Introductory Course in Binary Options
361,Forex Trading vs Option Trading
362,How to Invest in Stocks + Billionaire Investing Tips
363,Value Investing For Beginners
364,TRADING TACTICS
365,MQL4 Tutorial Bootcamp - Trading Robot Coding in Metatrader4
366,Ultimate Retirement: Build Your Own Dynamic Retirement Plan
367,build a solid foundation for trading options
368,Forex Scam: Avoid the scam today
369,Cost Accounting Crash Course
370,Option Trading for Rookies: Basic Option Strategies
371,Business Analysis:  Working with Use Cases
372,Learn to Raise the Funds You Need via Crowdfunding
373,Business finances
374,Financial Accounting - A Brief Introduction
375,Trading Economic Indicators - Complete Trading System
376,Foundation of Options Trading and Investing
377,Option Trading - How To Earn If You Can't Predict The Market
378,The Financial Analyst Skills Training (FAST) course 2017
379,Covered Calls - Powerful Income Strategy for Stock Traders
380,Accounting 1 Simplified for You
381,[Value Investing] Where White People Keep Their Money
382,How to Start Investing: Made Simple and Easy
383,Basics of Commerce A Complete Study
384,The Passive Investing Blueprint - Build Wealth Passively
385,7 Steps: Your Introduction to Trading
386,Forex - Elliott Wave Theory with Fibonacci. 
387,The Actuarial Profession: Basic Sciences and Principles
388,Investing in stocks: Avoid stock market loss
389,QuickBooks Online: Complete Guide & Certification tips
390,Build Financial Models & Value Companies The Easy Way
391,Adventure Capital: How to pay off debt 
392,Chart Patterns Trading Demystified
393,Financial Planning & Analysis: Building a Company's Budget
394,Simple things you must know before start FOREX (OFFER)
395,Practical Finance
396,Forex Trading: Comprehensive & Concise Forex Trading Course
397,Leaps Options Trading System - Diagonal Leaps Options Spread
398,Finance - Ratios Analysis & Interpretations
399,Forex Trading -  Learn to Trade From Scratch!
400,Technical Analysis tools for Stocks and Options trading
401,Quantitative Trading Analysis with R
402,Penny Stocks King: How 2 really Trade Penny Stocks (6 Hours)
403,Get Started With Penny Stocks -Step by Step Guide to Trading
404,CPA 101: How To Master Affiliate Marketing In No Time
405,Corporate Internal Controls and Fraud Controls
406,"Forex trading tactics, that work!"
407,Professional Risk Manager (PRM) Certification: Level 2
408,Trading Options Basics
409,Practical Trading on Financial Futures & Options Markets
410,Bookkeeping made simple
411,The Visual Learning Basic Accounting Course
412,ChalkTalk: Financial Accounting
413,The 7 fundamentals to Successful Cashflow Management
414,How to trade options
415,Coaching Course:Investment Analysis for your clients
416,Harnessing the Power of Growth Stocks
417,The Investment Banking Recruitment Series
418,Business Banking 101
419,CFA Level I Workshop 2: Financial Reporting & Analysis I 
420,Breakout Patterns Workshop by Pattern Trader
421,Asset Protection Using Offshore Companies
422,Get Credit for Your EIN That's Not Linked to Your SSN
423,Financial Translation
424,How to Pick Stocks
425,Binary Beginners Mastery Strategy.
426,Accounting 101-Master Class for Understanding Business
427,High-Frequency Trading & Dark Pools
428,How To Crowdfund
429,Financial Statement Fundamentals for Small Biz & Investors
430,Master The Stock Market with practice
431,Introduction to Trade Theory (Technical Analysis) For Stocks
432,Forex Trading For Beginners: Technical Trading
433,IAS 12 - Accounting for Income Taxes (Basics)
434,Surpassing Your Kickstarter Goals
435,Simple Linear Regression Analysis ( A Complete Course )
436,Forex: Learn to Trade Forex and FX Consistently
437,Trading: High-ROI Trading
438,Fundraising 101
439,Professional Bookkeeping & Accounting 2 - Bank Daybook
440,Filing with Companies House UK
441,"Build, Grow, and Protect Your Assets: A Step-by-Step Guide"
442,The Advantages of ETF Options and Index Options Trading
443,Learn to Trade Forex - from Beginner to Professional
444,"Investing In Stocks For Big Gains, Fundamental Investing"
445,Introduction to Equity Markets
446,Beginners Guide To Ichimoku Trading
447,Financial Management - Ratio Analysis
448,ALGOTECH Hedge Fund Method for Stock Market Trading
449,Futures/Commodity Trading
450,Complete Claritas Investment Certificate
451,Introduction to the economics of public services regulation
452,Accounting Standard 3 - An Analysis
453,Essentials of money value: Get a financial Life !
454,Introduction to Forex Trading Business For Beginners
455,Cryptocurrency (BTC & ETH) Investment & Trading Course 2017
456,Introduction to Project Management for Finance and Acct'g
457,Best Practices in Corporate Budgeting
458,Financial Statement Auditing Cycles
459,Case studies on credit appraisal for bankers
460,Building a Balanced Scorecard
461,Options Trading Foundation: Your journey to competency...
462,Forex how traders beat the markest with little experience
463,CFA Level 2- Quantitative Methods
464,Foundations of Investing
465,Capital Market Road Map
466,TRADING: 5K CHALLENGE
467,CurrencyFair - Avoid Bank Charges when converting currencies
468,Bitcoin - A Comprehensive Guide
469,Forex Trading
470,"The True ' Secret Sauce  For Stock Market Success"""
471,Bookkeeping to Command Senior Bookkeeping Wages
472,Take Your Career to the Next Level with MBA Finance
473,How to Read Financial Statements:  Build Financial Literacy.
474,Accounting Books of Accounts (College Level)
475,Forex Trading Profitably
476,Learn How to Trade Pump and Dumps. 5 Setups Well Explained.
477,Bitcoin Trading 101
478,Visualizing Data
479,IFRS Financial Reporting
480,Forex Trading System: Correlation EUR/GBP vs GBP/USD
481,"SAP Crystal Reports:Master-Detail,Cross-Tab,Sub-Reports"
482,Learn Financial Accounting Different
483,CFA Level I Workshop 4: Fixed Income and Equity
484,"IAS37 - Provisions, Contingents Liabilities & Assets"
485,What You Should Know to Become a Trader
486,Financial Reporting A Comprehensive Study
487,An Abundance Mindset: How to Craft Yours
488,Forex Trading Profit 183%p.a : Trend is Our Friend-ALGOTREND
489,How to Build a Massive Retirement Plan from Scratch!
490,Financial modeling: Build a forward looking financial model
491,Trading for Beginners - Entry Level
492,Bitcoin or How I Learned to Stop Worrying and Love Crypto
493,Trend Following Stocks: A Complete Trading System
494,Forex Basics
495,Accounting Bank Reconciliation Statement (College Level)
496,Bitcoin - Ethereum: Trading -Watch me manage my own account!
497,FOREX : Learn Technical Analysis
498,FastTrack to Stock Trading Strategies
