,course_title
2015,Learn 4 Chords and Play Thousands of Songs!
2016,#10 Hand Coordination - Transfer Chord Ballad 9 - C & Bb Key
2017,Acoustic Fingerstyle Guitar Course: Beginner to Advanced
2018,Guitar Chord Mastery!Turn Your Brain Into A Chord Encyclopia
2019,Play Piano 1 Master Class Intro:  Standards 2-5 Power Chords
2020,Best Beginner Guitar Lessons by Sam Lyons
2021,A new approach to piano and playing songs for beginners
2022,Learn Guitar: Zero to Guitar Fingerpicking in 30 days
2023,How to play Contemporary Piano
2024,Piano Technique Exercises Vol.1
2025,Instant Harmonica - Learning the Basic 12 Bar Blues Bassline
2026,#5  Piano Hand Coordination:  Piano Runs in 2 Beats Eb Key
2027,Modern Country Guitar: Technique Booster
2028,"Blues Guitar Lessons for Beginners: Chords, Rhythm and Lead"
2029,#4 Piano Hand Coordination: Fun Piano Runs in 2 Beats C Key
2030,3 step formula for playing guitar by ear
2031,"How to play 'Electric Guitar"",https://www.udemy.com/electric-guitar-beginners-method/,true,50,1105,5,20,Beginner Level,2 hours,2016-12-29T00:24:06Z
42038,Learn Piano Today: How to Play Piano Course in Quick Lessons"""
2032,Play Piano by Ear Today! SuperCourse
2033,Learn to Read & Write Music to play Piano & more instruments
2034,The Complete Piano Course - Master The Piano
2035,Learn to play your favorite guitar songs by ear
2036,Piano for Singer/Songwriters | Write Songs and Perform Live!
2037,Fun Beginner Ukulele Course
2038,Learn Guitar in 21 Days
2039,Fun Ukulele Strumming Course
2040,The Professional Bass Masterclass
2041,The Allman Brothers Guitar Roots And Techniques
2042,Blues Guitar Fundamentals
2043,#6 Piano Hand Coordination: Play Open 10 Ballad to 9/4 Song
2044,#7 Piano Hand Coordination: Play Piano Runs in 3 Beats 9/4
2045,Beginner Level Popular Piano Program - Month 1
2046,Piano Lessons for the R&B Fan
2047,Guitar Lessons - Blind Blake - King Of Ragtime Blues Guitar
2048,Darbuka Drumming: Learn how to play the Darbuka Dounbek
2049,Awesome Lead Guitar 1
2050,The art of piano improvisation
2051,How To Build A Professional Djembe: Create Music Beauty &Biz
2052,Advanced Euphonium Studies - Learn to Master the Euphonium!​
2053,Didgeridoo - from zero to HERO! Part Two. Intermediate.
2054,Fingerstyle Guitar by Jacques Stotzem - Advanced Level
2055,Trumpet Pro Series - You're going to love practicing Trumpet
2056,A Guide to Analog Synths: For the modern EDM enthusiast.
2057,Acoustic Blues Guitar Lessons
2058,Accelerate Your Guitar Learning With Metal Techniques
2059,Beginner Step by Step Keharwa Theka Tabla Course
2060,Just chords Piano: Learn to Play Piano Quickly - No Music
2061,Play Ukulele Now
2062,Acoustic Blues Guitar Lessons
2063,Piano Runs & Fills #1: Play Dreamy Whole Tone Scale Runs
2064,Play Piano Today - Easy Festive Favorites & Piano Party Hits
2065,The 80/20 Beginner Guitar Course
2066,Drums for Beginners
2067,Digital Pianist Course-Learn Piano & Keyboard Fast & Easy
2068,Learn to play guitar and sing at the same time
2069,Introduction to Ukulele 1
2070,Learn Flute FAST!
2071,Guitar Lessons - Soloing With Arpeggios - Essential Guide 
2072,Piano With Willie: Blues n' Boogie Vol. 3
2073,Instant Harmonica - play The Kesh (pt 1) it's easy and fun!
2074,Piano Lessons For Beginners: Learn Piano Quickly And Easily
2075,The Easy Beginner Drum Course
2076,Instant Harmonica - play Somewhere Over the Rainbow now!
2077,Instant Harmonica - play The Kesh (part 2) - easy and fun!
2078,The 80/20 Guitar: Write Music and Play Guitar in 30 Days
2079,Ukulele 2 : Level 1 KEY OF C AND STRUMS
2080,Guitar for Music Educators: Learning How to Teach Guitar
2081,Piano Tutorial : Ludovico Einaudi - Una Mattina
2082,Guitar Solo - Theory and Improvisation Lessons
2083,Bluegrass Guitar Essentials: Webisodes 3 & 4
2084,Instant Harmonica - play Christmas + Birthday songs now!
2085,Blues Master - Advanced Techniques Piano Course
2086,Bluegrass Guitar Essentials: Webisodes 5 & 6
2087,Trombone Lessons For Beginners
2088,Rhythm to Rock Drum Lesson 6
2089,Flute Pro Series - You're about to love practicing the flute
2090,How To Play Guitar - Everything You Need To Know To Start
2091,Trombone Pro Series - Fall in love with the Trombone
2092,Learn How To Play 25 Classic Hip Hop Songs Ch.2
2093,Learn to play tunes by ear on harmonica - no written music
2094,Fingerpicking for Guitar
2095,"Music Theory, Guitar and Ear Training"
2096,"Piano Unbound. Piano learning method, a course for beginners"
2097,Advanced Trombone Studies - Learn to Master the Trombone!
2098,"Euphonium Solos: Learn to Perform Three Fun, Unique Pieces!"
2099,Piano With Willie: Tritones & Phat Chords
2100,Piano for Kids: Developing Your Child's Creative Abilities
2101,Piano Lessons For The Hip Hop Fan
2102,French Horn Solos: Learn how to Perform Three Fun Pieces!
2103,Bluegrass Guitar Essentials: Webisodes 9 & 10
2104,Clarinet Lessons For Beginners
2105,Play music on Harmonica using 8 notes - learn easy tunes!
2106,Learn Piano Online-A Quiet Solace Piano Solo
2107,Bluegrass Guitar Essentials: Webisodes 7 & 8
2108,The Art of the Blues Shuffle - A Guitarist's Guide
2109,Learn Piano Online-Ambiance Piano Solo
2110,Piano Lessons For Beginners
2111,The Theory & Practice of Modes on the Guitar
2112,Learn How To Play The Trumpet
2113,Violin for Beginners
2114,Beginner Acoustic Guitar Lessons
2115,Aprendiendo Piano: Tocando piezas populares Vol.I
2116,Curso de Bateria - Explorando Diferentes Divisões
2117,Escalas Pentatónicas para guitarristas
2118,Brass Master Class
2119,Enseñando música: mejora tus clases de instrumento 
2120,Ukelele exprés: aprende a tocar en menos de un mes
2121,Curso de Guitarra para Principiantes
2122,Mundharmonika spielen - mein schönstes Hobby
2123,Aprende el acordeón de oído y con técnica –Nivel Intermedio–
2124,Présentation du Banjo Ténor
2125,Aprende a tocar el acordeón de botones
2126,Aprendiendo piano: Lectura de piezas clásicas Vol.I
2127,Pedais de efeito para Contrabaixo
2128,Mantenimiento y octavación para guitarras eléctricas
2129,Aprende a tocar el violín desde cero
2130,Aprende a tocar el teclado como los expertos
2131,Aprende a tocar el saxofón como siempre has querido
2132,Guitarra para principiantes
2133,Aprende a tocar flauta transversal sin complicaciones
2134,Aprende a tocar las escalas en el acordeón de botones.
2135,Curso de Violão Prático
2136,"Aprende a tocar percusiones: congas, bongós, maracas y más"
2137,Gitarre spielen - mein schönstes Hobby
2138,Aprende a tocar la guitarra acústica como un profesional
2139,Guitar Lesson - Five Steps to Learn Barre Chords
2140,"Easy Piano Basics™ - Learn Piano, No Prior Experience Needed"
2141,Guitar Technique Mastery: The Ultimate Chop Building Workout
2142,Inside Drum Technique
2143,"Learn to Play Tarrega, Bach, and Sor on Classical Guitar"
2144,Create Beautiful Music On The Piano Like a Pro In Minutes
2145,Instant Harmonica - play the great Irish tune Molly Malone!
2146,Instant Harmonica - play 'Can't Help Falling in Love' now!
2147,Arpeggios for Guitar made Easy! Dominate the Fretboard
2148,Guitar Lessons - The Modal System - Modes Essentials
2149,Learn to Play Percussion: Beginner to Pro made the Easy Way!
2150,Modern Piano Lessons For Beginners
2151,World Percussion: Complete Lessons for Everyone
2152,Learn Lion (Saroo) Soundtrack On The Piano By Ear
2153,Acoustic Blues Guitar Lessons
2154,Play Guitar and Understand Music Quick & Easy in 28 Days!
2155,Learn How to Play the Violin - Violin Basics
2156,Swing Low - The 101 Authentic Nashville Piano Style Course
2157,Guitar:Play 5 Easy Christmas Chord Progressions On Guitar
2158,Get Piano Skills TODAY!!! 
2159,Learn the Violin - Scales and Fundamentals
2160,Piano With Willie Building Technique with Scales Vol. 2
2161,Master Flute Playing: Intermediate Instruction Made Simple!
2162,How to Sing and Play the Guitar (at the same time)
2163,"Super Beginner Guitar - start right, start awesome"
2164,"Introduction to Guitar 'A Course for Beginners"",https://www.udemy.com/introduction-to-guitar/,true,25,163,11,56,Beginner Level,2.5 hours,2014-10-30T15:59:39Z
650804,Guitar  Master Class Learning How to Play Guitar from A to Z"""
2165,Rhythm to Rock Drum Lesson 5
2166,Gibson's Learn & Master Guitar
2167,Master the Trombone: Intermediate Instruction Made Simple!
2168,Walking Bass Fundamentals
2169,Circular Breathing for musicians - practical skills
2170,Electric Bass for Busy Beginners Course 1
2171,Guitar for Absolute Beginners (Class 1)
2172,Tenor Banjo for Absolute Beginners
2173,Guitar Lessons - 50 Essential Fast Legato Licks
2174,Aprenda a tocar Pandeiro - Curso Iniciante - Samba/Choro
2175,Aprende batería con el nuevo método IDT
2176,5 lecciones que todo guitarrista debe tomar
2177,Los 7 Acordes para Tocarlo Todo en un fin de semana
2178,Curso de Violão Popular
2179,Aprendiendo Piano: Ejercicios de calentamiento
2180,Aprendiendo piano: Lectura de piezas clásicas Vol.II
2181,"Aprende a tocar el Acordeón 'de oído y con técnica"",https://www.udemy.com/aprende-a-tocar-el-acordeon-de-oido-y-con-tecnica/,true,25,93,21,34,Beginner Level,4 hours,2014-09-16T19:51:45Z
263432,Aprende los Secretos de la Armónica con HARP&SOUL"""
2182,Guitarra Desde Cero - PARTE 1
2183,Super-Curso de Guitarra Práctico Para Principiantes
2184,Explosão Pentatônica
2185,Complete Beginners Introduction to Guitar
2186,Learn 10 Scottish Tunes Piano Easy Level
2187,Fingerpicking Fundamentals
2188,Piano With A Pro
2189,Piano Lessons for Beginners: Play the Piano AND Read Music!
2190,Master the Tuba - Intermediate Instruction Made Simple!
2191,The Fun and Effective Piano Course
2192,Advanced Flute Studies - Learn to Master the Flute!​
2193,Alternate Picking Speed & Accuracy
2194,"Master the Euphonium with Simple, Intermediate Instruction!"
2195,Master the Clarinet: Intermediate Instruction Made Simple!
2196,Advanced Clarinet Studies - Learn to Master the Clarinet!
2197,Aprende a tocar ritmo pop en el piano y teclado
2198,Aprendiendo Piano: Tocando piezas populares Vol.II
2199,Comment jouer du Pianoforte
2200,Aprende a tocar blues en el piano y teclado
2201,ABC DO VIOLÃO E GUITARRA
2202,Suonare la Chitarra
2203,Aprende todos los secretos de la guitarra flamenca
2204,こどもギターレッスン　リトルギタリストⅠ
2205,Aprende cómo tocar el Bajo Sexto
2206,Coach Guitar - Apprendre la GUITARE facile avec des COULEURS
2207,Sistema Completo De Guitarra Rítmica Para Principiantes
2208,Curso de batería online de Patricio Iglesias (Santa Sabina)
2209,"Learn Piano with Beyer, 15 Minutes Challenge"
2210,"Classical Guitar Master Class: 'Alman  """
2211,Blues Accelerator - 21 Days to Blues Guitar Mastery
2212,Alto Saxophone Lessons For Beginners
2213,Instant Harmonica - Christmas; play Jingle Bells part 2 now!
2214,Piano With Willie: Jazz & Gospel Exercises
2215,Bending the blue notes to give you killer sound on harmonica
2216,"Beginner's Guitar: Tuning, Strumming, and Chords!"
2217,Instant Harmonica - play The Lion Sleeps Tonight - today!
2218,Piano With Willie Building Technique with Scales Vol. 3
2219,Instant Bodhran - part two; learning further drumming skills
2220,Guitar Essentials
2221,Rhythm to Rock Drum Lessons
2222,Learn to play and improve 12 bar blues harmonica solos
2223,Learn to improvise on your harmonica - in nice easy steps
2224,Learning Electric Guitar for Absolute Beginners
2225,Advanced Bassoon Studies - Learn to Master the Bassoon!​
2226,Blues Guitar Lessons: Play Like the Greats - All Levels
2227,Instant Harmonica - play Whiskey in the Jar + Molly Malone!
2228,Learn To Play Trumpet Fast Using The Passive Trumpet Tutor
2229,Electric Bass Right From The Start
2230,Beginner Guitar Essentials
2231,Advanced Tuba Studies - Become a Master of the Tuba!​
2232,'Greensleeves' Creative Piano Lessons Course
2233,Rhythm to Rock Drum Lesson 4
2234,Hands On Guitar: Beyond Beginner
2235,Instant harmonica - play Auld Lang Syne the neet (tonight)!
2236,Piano The Hard Way -  Fast Way To Life Long Piano Enjoyment
2237,The Ultimate Method for Learning Modern Piano & Keyboards
2238,Master the Bassoon - Intermediate Instruction Made Simple!
2239,Oboe Pro Series - You're going to love practicing the Oboe
2240,Instant Harmonica - play this classic GAME OF THRONES theme!
2241,"Trumpet Solos: Learn how to Perform Three Fun, Unique Pieces"
2242,Learn 4 Vital things that will make your DRUM PLAYING EASIER
2243,Sax Solos: Learn how to Perform Three Fun and Unique Pieces!
2244,Traditional-Style Electric Blues Guitar For Beginners
2245,Aprende a tocar los mejores solos en la guitarra eléctrica
2246,Aprende a tocar la guitarra
2247,Aprende a tocar el piano desde cero
2248,Aprende a tocar el clarinete.  
2249,Ahora aprende a tocar jazz en el piano
2250,こどもギターレッスン　リトルギタリストⅡ
2251,Aprende a tocar el contrabajo sin complicaciones
2252,Aprende a tocar la guitarra eléctrica
2253,Aprende a improvisar en la guitarra eléctrica
2254,Curso de Teclado
2255,Guitarra Acústica en Siete Días
2256,improvisación de Guitarra
2257,Step by Step Classical Guitar Course
2258,Piano With Willie Building Technique with Scales Vol. 4
2259,Back In Black the AC/DC Classic Rock Track
2260,Keyboard Basics
2261,Beginner Guitar Lessons
2262,Guitar Fundamentals for Beginners
2263,Easy Piano - learn and play along
2264,Learn Piano: The Basics of Keyboards
2265,Bassoon Pro Series - You're going to love practicing Bassoon
2266,Acoustic Guitar Lessons For Beginners
2267,Coach Guitar - Amazing New Way To Learn Guitar With Colors
2268,Mastering the Art of Guitar Chords
2269,30 Day Guitar Jump Start for Success
2270,Learn to Play Bassoon: Beginner to Pro in Under Four Hours!
2271,The 7 Day Guitar Method
2272,Instant Harmonica - play Star Wars + the Lion Sleeps now!
2273,Instant harmonica - play Adele's wonderful 'Hello' today!
2274,Guitar Strumming 101 - Have More Fun Playing Songs You Love
2275,Master Oboe Playing: Intermediate Instruction Made Simple!
2276,Drum Set for Beginners
2277,Guitar Lessons - Economy Picking Essentials
2278,Blues Guitar Lessons - Blues Guitar - Robert Johnson
2279,TAKE NOTE BEGINNER CLARINET!  –  Fun with Fundamental Skills
2280,Learn to Play Irish Fiddle
2281,Hands-On Guitar: The Beginner's Guide
2282,Slap Bass For Beginners
2283,Piano Lessons for Beginners Made Easy
2284,Horn Pro Series - You're going to love playing French Horn
2285,Instant Harmonica - play the Irish tune Whiskey in the Jar!
2286,Didgeridoo - from zero to HERO! Part Three. Advanced level.
2287,Saxophone Pro Series - You're going to love practicing Sax
2288,Easy Piano for Kids - Complete Beginner Piano Course
2289,Guitar Lessons - Two Handed Tapping Essentials
2290,Clarinet Pro Series - Fall in love with the Clarinet
2291,Advanced Trumpet Studies - Learn to Master the Trumpet!​
2292,Poldark TV series Soundtracks for Piano-Quicklessons
2293,Master the Saxophone: Intermediate Instruction Made Simple!
2294,You Can Play Jazz Saxophone
2295,"Improvise Puccini´s 'E Lucevan le Stelle on Piano"""
2296,Building Up To Barre Chords
2297,Learn the Violin - Bowing Techniques
2298,Blues Guitar Lessons - Volume 3 - Minor Blues Essentials
2299,Back 2 The Basics
2300,Play the Jews Harp - instant skills for non musicians.
2301,Master Trumpet Playing: Intermediate Instruction Made Simple
2302,Practical Guitar Theory: Level 1
2303,Instant harmonica - enjoy playing Silent Night tonight!
2304,HARP&SOUL  |  Learn the Secrets of the Harmonica
2305,"Play Leyenda, Canarios, and Bach on Classical Guitar"
2306,Instant Harmonica - play the cool tune Dirty Old Town now!
2307,Ultimate Beginner Guitar Guide - Both Acoustic & Electric 
2308,Guitar Lessons : Rock Guitar in 1 Day!
2309,Tenor Banjo
2310,Introduction to Lead Guitar
2311,Piano With Willie: Basics of Improvisation
2312,Euphonium Pro Series - Fall in love with the Euphonium
2313,Pure Rock Guitar : Play Like the Gods of Rock!
2314,Master the French Horn: Intermediate Instruction Made Simple
2315,Classical Guitar Technique: 80/20
2316,Total beginner to intermediate guitar - Learn to play by ear
2317,Aprende escalas y arpegios  Vol. I: Modo mayor
2318,Aprende a tocar Guitarra RAPIDO y FACIL con Guitarsimple
2319,Ukulele lernen für Papas mit Bruder Jakob
2320,Tin Whistle Básico
2321,Leve a sua técnica de pedal duplo para um novo patamar
2322,Sevillanas con Castañuelas - Baile y toque al mismo tiempo
2323,見てわかる！やさしく独習アコギ（入門編）TAKA先生のアコースティックギターレッスンⅠ
2324,【すぐに覚える！】ASALATO-アサラト(打楽器)初心者向け入門講座
2325,Aprende a Tocar Teclado - Piano
2326,Castañuelas por Sevillanas - Curso del toque de castañuelas
2327,Aprende a tocar el acordeón de botones
2328,Aprende a tocar Música Cristiana en el piano y teclado
2329,Easy Guitar Songwriting And Harmony
2330,How to play easy tunes on the harmonica - just the basics
2331,Rhythm to Rock Drum Lessons 2
2332,Instant Harmonica - play Over the Rainbow + Skye Boat now!
2333,Bagpipe Instruction For Beginners
2334,"Flute Solos: Learn how to Perform Three Fun, Unique Pieces"
2335,Rhythm to Rock Drum Lessons 3
2336,Guitar Lessons - Sweep Picking Arpeggio Essentials
2337,Painless Piano!
2338,Beginning Flute Lessons
2339,Piano Lesson Variety
2340,Pop and Jazz Keyboards and Harmony (beginner level)
2341,Starting to play the blues on your harmonica in easy steps 
2342,Learn the Viola - Scales and Fundamentals
2343,"Learn to Play 'Let It Snow on Piano"""
2344,Instant Harmonica - play the Irish anthem Danny Boy today!
2345,Piano Building Blocks: Learn Chord Additions & Variations
2346,Advanced Saxophone Studies - Learn to Master the Saxophone!
2347,Killer Harmonica sounds using the tongue and bending notes 
2348,Instant Harmonica - play When the Saints on harmonica now!
2349,Strumming the Guitar - 5 Lessons on Strum Patterns
2350,Learn Piano Online-Keys to the Keyboard
2351,Ukulele Lessons For Beginners - Fast Track Your Learning
2352,Blues Guitar Lessons - Ragtime Blues Guitar
2353,Getting Started with Power Chords
2354,Blues Master - Professional Techniques Piano Course
2355,Drumming 101: The Essential Elements
2356,Flute Lessons For Beginners
2357,Guitar for Christmas!
2358,Learn Piano Online-Nocturnal Piano Solo
2359,Guitar Chords and Basic Strumming
2360,Getting Started on the Acoustic Guitar
2361,Learn Piano Online-In the Garden Piano Solo
2362,Saxophone Essentials: Beginners Course
2363,Learn To Play The Guitar In A Day
2364,88 Logic - The Essential Guide To Learning Piano
2365,Tuba Solos: Learn how to Perform Three Fun and Unique Pieces
2366,Instant Harmonica - play Dylan's Like a Rolling Stone now!
2367,Advanced Oboe Studies - Become a Master Oboist!​
2368,Instant Harmonica - play 'I just called to say I love you'
2369,Jazz piano improvisation: The girl form Ipanema. Bossa nova
2370,Drum Lessons For Beginners
2371,Piano With Willie: Jazz Kids - Vol 3
2372,Quick Piano Lessons - Tutorials for Drake's Greatest Hits
2373,"Bluegrass Guitar Essentials: Webisodes 13, 14, & 15"
2374,Guitar - Rock - Beginner with Marc Seal
2375,"Oboe Solos: Learn to Perform Three Fun, Unique Pieces!"
2376,Bluegrass Guitar Essentials: Webisodes 11 & 12
2377,Advanced Horn Studies - Learn to Master the French Horn!​
2378,Learn To Play Guitar Complete Beginners Quick Start
2379,Piano With Willie: Jazz Kids - Vol 4
2380,Instant Harmonica - play the old Popeye Spinach song now !
2381,Piano With Willie: Jazz Kids - Vol 2
2382,Practice guitar with no previous experience and become a pro
2383,The Music Coach Online Spirit Drum Course
2384,Make Electronic Music with the iPad
2385,Learn Loreena McKennitt Songs-Quicklessons Piano Course
2386,Guitar 201: Breakthroughs
2387,Major Scales and Modes for Chromatic Harmonica
2388,Play Guitar with Rhythm - 5 Easy Lessons
2389,Coaching Bundle: Guitar for Music Educators: Part 1
2390,Coaching Bundle: Guitar for Music Educators: Part 2
2391,Ukulele 3:  Intermediate
2392,"Beginners Guitar Course - 'Try it and love it method"""
2393,Coaching Course: Rhythm Instruction for Music Educators P1
2394,Learn Pirates of the Caribbean by Ear on the Piano
2395,Coaching Course: Rhythm Instruction for Music Educators P2
2396,4 Week Rhythm Mastery
2397,Tune that Sour Note on Your Piano
2398,Learn Vikings Soundtracks on the Piano by Ear
2399,Learn to Play Piano Like a Pro - Easy Piano Course 1
2400,ABRSM Grade III Piano Class - Handel Sonatina in G 2017-2018
2401,Instant Harmonica - play 12 bar blues Big Walter style now!
2402,Fingerpicking Blues Guitar Lessons - Bottleneck Guitar
2403,Spice up your playing with some easy Flamenco techniques! 
2404,Beginners Guide to Playing Guitar - Step-by-step System
2405,Guitar Kick Start
2406,Instant Harmonica – play Beethoven’s Ode to Joy right now!
2407,Funk Rhythm Guitar Techniques
2408,Flamenco Guitar
2409,Learn to play the Bouzouki - Greek Bouzouki Lessons
2410,Guitar Looper Basic Training
2411,Piano With Willie: Jazz Kids - Vol 1
2412,Instant Harmonica - play the Drunken Sailor sea shanty now! 
2413,Learn to Play Sweet Child of Mine
2414,Bluegrass Guitar Essentials: Webisodes 1 & 2
2415,Learn Monster GODJ
2416,What you can learn before Piano Lessons
2417,Learn to Play Tabla - The Indian drums
2418,Gitarre spielen wie die Profis
2419,Curso de piano 101 - Tocando partituras y acordes -
2420,Sintetizadores e Síntese Subtrativa
2421,Spielend Klavier lernen mit Freude und Erfolg
2422,Curso de ejercicios técnicos al piano Vol.2
2423,Curso de ejercicios técnicos al piano Vol.1
2424,Aprende escalas y arpegios Vol.2 : Modo menor
2425,Instant Harmonica - play Blowing in the Wind + Popeye theme!
2426,Instant Harmonica - play jazzy Autumn Leaves now (part one)
2427,Trumpet Lessons For Beginners
2428,Guitar - Rock - Beginner/Intermediate with Marc Seal
2429,Learn to play in the Key of G on any Bluegrass Instrument
2430,Beginner Guitar Method
2431,How to Play Dan Fogelberg Songs on Guitar
2432,Jews Harp - Advanced course
2433,Instant Harmonica - play jazzy Autumn Leaves now (part two)
2434,Jazz Guitar Reharmonization for Autumn Leaves
2435,Tenor Saxophone Lessons For Beginners
2436,Mike G's Beginner Drum Course: Part 2
2437,Instant Harmonica - play Summertime + Drunken Sailor now!
2438,Add Slide To Your Guitar Playing
2439,Piano With Willie: Piano Chords Vol. 2
2440,Drum Lessons For Beginners
2441,Classical Guitar Finger-Picking: Right Hand Arpeggios
2442,"Rapidly Learn & Master Acoustic Guitar, Classic Fingerstyle"
2443,Play tunes on harmonica and learn how to bend some notes
2444,Instant Harmonica - play Yesterday + Scarborough Fair today!
2445,Violin lessons for beginners
2446,Old-Time Banjo for the Absolute Beginner
2447,"Learn Guitar The Easy Way, It's Faster"
2448,Learn Oud 2
2449,The Essentials of Acoustic Guitar Strumming Patterns
2450,Acoustic Guitar After The Basics
2451,Bossa Nova - Guitar for Beginners
2452,Piano With Willie: Piano Chords Vol. 1
2453,Instant Harmonica - play Summertime in 8 fun & easy lessons
2454,Learn to Play the Tuba: Beginner to Pro in Under Five Hours!
2455,Play Autumn Leaves' falling notes on piano with no reading!
2456,Learn Basics of South Indian Carnatic Flute - Level 2
2457,A Year's Worth of Piano Lessons in One Weekend
2458,Bones of the Blues - learn 4 cool tunes to expert level now!
2459,GUITAR #1: Beginner Basics and Beyond
2460,Pure Modal Magic: The Complete Guitar Modes Solution
2461,Aprende diferentes ritmos con la guitarra rítmica
2462,Aprender a tocar la batería sin salir de casa
2463,Aprende a tocar el bajo eléctrico 
2464,Aprende todos los secretos de la salsa para piano
2465,Aprende a tocar ritmos latinos en el teclado
2466,Ukulele lernen für Papas mit Aram sam sam
2467,Aprende a tocar la trompeta
2468,Curso de guitarra para principiantes.
2469,Aprende a tocar Jazz y Ritmos Latinos en la guitarra
2470,こどもギターレッスン　リトルギタリストⅢ（完結編）
2471,Aprende a tocar la flauta dulce de forma sencilla y gradual
2472,"Aprende a tocar jazz, salsa y blues en el piano"
2473,Learn Web Designing & HTML5/CSS3 Essentials in 4-Hours
2474,Learning Dynamic Website Design - PHP MySQL and JavaScript
2475,ChatBots: Messenger ChatBot with API.AI and Node.JS
2476,Projects in HTML5
2477,Programming Foundations: HTML5 + CSS3 for Entrepreneurs 2015
2478,How To Make A Wordpress Website 2017 | Divi Theme Tutorial
2479,Build Your Own Backend REST API using Django REST Framework
2480,Angular and Firebase - Build a Web App with Typescript
2481,Web Development Masterclass - Complete Certificate Course
2482,Spring Boot Tutorial For Beginners
2483,The Complete Bootstrap Masterclass Course - Build 4 Projects
2484,Scaling Docker on AWS
2485,Learn JavaScript for beginners
2486,HTML Tutorial: HTML & CSS for Beginners
2487,Learn by Doing: Vue JS 2.0 the Right Way
2488,Learn Complete Web Development From Scratch
2489,Introduction to Web Development: HTML
2490,Web Site for Beginners - Learn Web Building like knitting
2491,How To Make A Wordpress Website 2017 - Divi Theme Tutorial
2492,Web Programming with Python
2493,PHP Login and Registration System - Email Confirm Activation
2494,PSD to Responsive HTML5: Beginner to Advanced
2495,Ultimate Web Developer Course Build 10 Websites from Scratch
2496,Rapid Website Design with Bootstrap
2497,Build Enterprise Applications with Angular 2 (and Angular 4)
2498,Angular 4 (2+) Crash Course for Beginners
2499,Accelerated JavaScript Training
2500,"Beginner API development in Node, Express, ES6, & MongoDB"
2501,React JS and Redux - Mastering Web Apps
2502,Web Development w/ Google’s Go (golang) Programming Language
2503,Git a Web Developer Job: Mastering the Modern Workflow
2504,The Complete WordPress Website Business Course
2505,The Complete HTML and CSS Course For Beginners
2506,Learn  Bootstrap Development By Building 10 Projects
2507,Advanced Javascript
2508,Dissecting Ruby on Rails 5 - Become a Professional Developer
